NR_VOTAVEL,DS_CARGO,NM_VOTAVEL,QT_VOTOS
10,DEPUTADO FEDERAL,REPUBLICANOS,2432
11,DEPUTADO FEDERAL,PROGRESSISTAS,9188
12,DEPUTADO FEDERAL,Partido Democrático Trabalhista,42814
13,DEPUTADO FEDERAL,Partido dos Trabalhadores,65530
14,DEPUTADO FEDERAL,Partido Trabalhista Brasileiro,1518
15,DEPUTADO FEDERAL,Movimento Democrático Brasileiro,5239
16,DEPUTADO FEDERAL,Partido Socialista dos Trabalhadores Unificado,444
18,DEPUTADO FEDERAL,Rede Sustentabilidade,381
19,DEPUTADO FEDERAL,Podemos,530
20,DEPUTADO FEDERAL,Partido Social Cristão,424
21,DEPUTADO FEDERAL,Partido Comunista Brasileiro,2073
22,DEPUTADO FEDERAL,Partido Liberal,16412
23,DEPUTADO FEDERAL,Cidadania,3986
29,DEPUTADO FEDERAL,Partido da Causa Operária,687
30,DEPUTADO FEDERAL,Partido Novo,834
33,DEPUTADO FEDERAL,Partido da Mobilização Nacional,3876
35,DEPUTADO FEDERAL,Partido da Mulher Brasileira,307
36,DEPUTADO FEDERAL,AGIR,644
40,DEPUTADO FEDERAL,Partido Socialista Brasileiro,1637
43,DEPUTADO FEDERAL,Partido Verde,1403
44,DEPUTADO FEDERAL,UNIÃO BRASIL,10205
45,DEPUTADO FEDERAL,Partido da Social Democracia Brasileira,2181
50,DEPUTADO FEDERAL,Partido Socialismo e Liberdade,3244
51,DEPUTADO FEDERAL,Patriota,356
55,DEPUTADO FEDERAL,Partido Social Democrático,6803
65,DEPUTADO FEDERAL,Partido Comunista do Brasil,2984
70,DEPUTADO FEDERAL,AVANTE,3446
80,DEPUTADO FEDERAL,Unidade Popular,187
90,DEPUTADO FEDERAL,Partido Republicano da Ordem Social,337
95,DEPUTADO FEDERAL,VOTO BRANCO,295582
96,DEPUTADO FEDERAL,VOTO NULO,202288
1000,DEPUTADO FEDERAL,VANESSA FALCÃO DE SOUZA CASTELO LIMA,29390
1002,DEPUTADO FEDERAL,FRANCISCA FATIMA DE OLIVEIRA MOTA SILVA,708
1010,DEPUTADO FEDERAL,RONALDO MANCHADO MARTINS,104502
1011,DEPUTADO FEDERAL,ROSA STEFANIA MARINHO GOMES RODRIGUES,888
1012,DEPUTADO FEDERAL,FELIPE MONTEIRO ANDRADE ARAÚJO,2357
1013,DEPUTADO FEDERAL,CRISTIANE COLARES MUNIZ,504
1016,DEPUTADO FEDERAL,FRANCISCO RODRIGO DE MATOS DE SOUZA,6028
1020,DEPUTADO FEDERAL,ERLAN MARTINS DOS SANTOS,17177
1023,DEPUTADO FEDERAL,ABRAÃO GOMES DA SILVA,3974
1030,DEPUTADO FEDERAL,VERISSIMO DOS SANTOS FREITAS,1892
1033,DEPUTADO FEDERAL,RODRIGO DOS SANTOS BESERRA,1598
1044,DEPUTADO FEDERAL,GABRIELLA PAIVA DOS SANTOS,1082
1055,DEPUTADO FEDERAL,EMANUELLE SANTOS CARNEIRO SILVA,2401
1090,DEPUTADO FEDERAL,FRANCISCO WAGNER LOBO PEREIRA,3012
1093,DEPUTADO FEDERAL,NAPOLEÃO DE VASCONCELOS MONTE,828
1099,DEPUTADO FEDERAL,RAMSÉS SERRA,598
1100,DEPUTADO FEDERAL,RAFAEL AURELIANO GONÇALVES BRANCO,13716
1111,DEPUTADO FEDERAL,ANTONIO JOSÉ AGUIAR ALBUQUERQUE,155456
1112,DEPUTADO FEDERAL,RAIMUNDO GOMES FARIAS,4414
1113,DEPUTADO FEDERAL,ELINETE TORRES DA SILVA,847
1118,DEPUTADO FEDERAL,FRANCISCA ANTONIA DE SOUSA SILVA,1138
1122,DEPUTADO FEDERAL,PEDRO SÉRGIO TEIXEIRA DANTAS,5599
1123,DEPUTADO FEDERAL,JOSÉ TARSO MAGNO TEIXEIRA DA SILVA,17153
1133,DEPUTADO FEDERAL,XISTO SOARES DE OLIVEIRA,3032
1139,DEPUTADO FEDERAL,TERESA CRISTINA ALCANTARA PINHO,68
1145,DEPUTADO FEDERAL,STEPHAN GOMES DE CARVALHO,1084
1155,DEPUTADO FEDERAL,THIAGO ARAGÃO ESMERALDO,6984
1171,DEPUTADO FEDERAL,JOSE LISBOA DA SILVA,567
1177,DEPUTADO FEDERAL,CARLOS ALBERTO ALVES ROCHA,491
1188,DEPUTADO FEDERAL,LUHANNA URYA MACIEL BEZERRA,4267
1190,DEPUTADO FEDERAL,FRANCISCO ANTONIO DO CARMO,789
1199,DEPUTADO FEDERAL,ELIENE COUTO CAMPELO,670
1201,DEPUTADO FEDERAL,JULIO BRIZZI NETO,17320
1212,DEPUTADO FEDERAL,JOSÉ LEÔNIDAS DE MENEZES CRISTINO,74866
1213,DEPUTADO FEDERAL,ANTONIO IDILVAN DE LIMA ALENCAR,187433
1214,DEPUTADO FEDERAL,EDUARDO HENRIQUE MAIA BISMARCK,102287
1215,DEPUTADO FEDERAL,FLÁVIO ROBERTO FERREIRA VAZ,610
1221,DEPUTADO FEDERAL,CARLOS MAURO BENEVIDES FILHO,135038
1222,DEPUTADO FEDERAL,MARIA DO ROSÁRIO RAMALHO GARCIA,4964
1232,DEPUTADO FEDERAL,NATÁLIA SOARES RIOS,3251
1233,DEPUTADO FEDERAL,MARCOS ROBÉRIO RIBEIRO MONTEIRO,151030
1234,DEPUTADO FEDERAL,ANDRÉ PEIXOTO FIGUEIREDO LIMA,111886
1245,DEPUTADO FEDERAL,ADRIELLY DE PAULA TEIXEIRA,3604
1251,DEPUTADO FEDERAL,JOSÉ ARNON CRUZ BEZERRA DE MENEZES,37057
1252,DEPUTADO FEDERAL,KARINA CORDEIRO DE SOUZA RODRIGUES,1513
1255,DEPUTADO FEDERAL,MARIA CRERINEUMA DE OLIVEIRA SILVA,2443
1269,DEPUTADO FEDERAL,ELAYNE SILVA CARVALHO,1599
1277,DEPUTADO FEDERAL,ADAIL FERNANDES VIEIRA JUNIOR,26456
1285,DEPUTADO FEDERAL,IANNA FERNANDES DE ALMEIDA BRANDÃO,3494
1292,DEPUTADO FEDERAL,ANA PAULA BRANDÃO DA SILVA FARIAS,49411
1299,DEPUTADO FEDERAL,FRANCISCO NILSON ALVES DINIZ,18331
1300,DEPUTADO FEDERAL,HILTON JOSE DE SOUSA,1405
1303,DEPUTADO FEDERAL,EDNA FRANCISCA DO NASCIMENTO,500
1311,DEPUTADO FEDERAL,MARIA DE LOURDES PAZ FELIX,5358
1313,DEPUTADO FEDERAL,LUIZIANNE DE OLIVEIRA LINS,182232
1314,DEPUTADO FEDERAL,MARIA DAS GRAÇAS COSTA,5264
1319,DEPUTADO FEDERAL,REJANE PINHEIRO JARDELINO,562
1321,DEPUTADO FEDERAL,CHRISTIANNE MARIE AGUIAR COELHO,21325
1322,DEPUTADO FEDERAL,JOSE NOBRE GUIMARAES,186136
1323,DEPUTADO FEDERAL,FRANCISCO ANTONIO FERREIRA LOPES,3835
1326,DEPUTADO FEDERAL,CELSO FARIAS FERREIRA,1760
1331,DEPUTADO FEDERAL,LEDA VASCONCELOS CARVALHO,3359
1333,DEPUTADO FEDERAL,JOSE AIRTON FELIX CIRILO DA SILVA,82274
1353,DEPUTADO FEDERAL,PAULO EMILIO CORDEIRO CAMPOS,1040
1369,DEPUTADO FEDERAL,COSME DO VALE AQUINO,1638
1399,DEPUTADO FEDERAL,MAX SWELL VERAS RIBEIRO,239
1400,DEPUTADO FEDERAL,JOSÉ GERALDO DE QUEIROS,164
1407,DEPUTADO FEDERAL,EVANDRO FURTADO DE LIMA,300
1412,DEPUTADO FEDERAL,MAURO LÚCIO SIMÕES COSTA,163
1414,DEPUTADO FEDERAL,BRUNO HOLANDA DOS SANTOS,343
1415,DEPUTADO FEDERAL,EDUARDO DA SILVA DOS SANTOS,131
1421,DEPUTADO FEDERAL,ENAIDE PAULINO DE SOUZA,81
1422,DEPUTADO FEDERAL,BENJAMIM BEZERRA DE MENEZES NETO,679
1425,DEPUTADO FEDERAL,JOSÉ AIRTON MACEDO DE SOUSA,206
1429,DEPUTADO FEDERAL,FRANCISCO REGINALDO MOREIRA GOMES,21
1433,DEPUTADO FEDERAL,EDINA NOGUEIRA DE CASTRO ROCHA,226
1439,DEPUTADO FEDERAL,DEAN DIAS DE ALMEIDA,39
1441,DEPUTADO FEDERAL,SUENY RABELO DANTAS,108
1444,DEPUTADO FEDERAL,JORDANIA MARIA ALVES DE OLIVEIRA,466
1445,DEPUTADO FEDERAL,DANIELE LINO MAGALHÃES,80
1447,DEPUTADO FEDERAL,ANTONIO ILTON DE SOUSA CASTRO,240
1450,DEPUTADO FEDERAL,RITA DE CÁSSIA FERREIRA,514
1455,DEPUTADO FEDERAL,ORIEL MOTA FILHO,471
1456,DEPUTADO FEDERAL,MARIGESIO MOURA DA SILVA,154
1470,DEPUTADO FEDERAL,RAYANA MARIA MILEM GUERRA,909
1477,DEPUTADO FEDERAL,ANTONIO CARLOS ALENCAR REBOUÇAS,878
1478,DEPUTADO FEDERAL,MARIA CELIA FERREIRA LOPES DUARTE,111
1499,DEPUTADO FEDERAL,LUZILANE DE SOUZA SILVA,506
1500,DEPUTADO FEDERAL,ÉRICO JOVINO SALES,4258
1502,DEPUTADO FEDERAL,SAMUEL CORREIA DA SILVA,140
1511,DEPUTADO FEDERAL,FRANCY AMANDA SOARES CORREIA,2218
1512,DEPUTADO FEDERAL,MARIA HENRIQUE DA SILVA SOUSA,1794
1513,DEPUTADO FEDERAL,FRANCISCO CÉSAR NOGUEIRA DA SILVA,506
1515,DEPUTADO FEDERAL,JOSÉ MOACENY FÉLIX RODRIGUES FILHO,4709
1516,DEPUTADO FEDERAL,ABRAÃO LUCAS CORDEIRO DOS SANTOS,414
1520,DEPUTADO FEDERAL,FRANCISCO FABIANO CLAUDIANO DE OLIVEIRA,3613
1522,DEPUTADO FEDERAL,RONDINELLE PEREIRA DE FREITAS,38820
1525,DEPUTADO FEDERAL,MARCIO BATISTA BARBOSA,1262
1531,DEPUTADO FEDERAL,JOSÉ ERONILDO NARCISO DA SILVA,1183
1533,DEPUTADO FEDERAL,EUNÍCIO LOPES DE OLIVEIRA,188289
1544,DEPUTADO FEDERAL,ESMERALDA ROBERTO DE SOUSA LIMA,238
1551,DEPUTADO FEDERAL,BEATRIZ FELIPE BRAGA,333
1556,DEPUTADO FEDERAL,LUIZ CLAUDIO ALVES BRITO,251
1566,DEPUTADO FEDERAL,EWERTON LACERDA SANTANA,246
1567,DEPUTADO FEDERAL,MARIA LINDETE DA SILVA BARROSO,493
1569,DEPUTADO FEDERAL,POLLYANNA KELLY RIBEIRO DE LIMA,331
1577,DEPUTADO FEDERAL,IVAN GONÇALVES LEITE,554
1580,DEPUTADO FEDERAL,CICERO ANTÔNIO PINHEIRO DOS SANTOS,788
1588,DEPUTADO FEDERAL,REGINA MAURA VILLELA BARBOZA,2423
1599,DEPUTADO FEDERAL,MICHAEL GANDHI MONTEIRO DOS SANTOS,1443
1600,DEPUTADO FEDERAL,EDWEYNE MARTINS,652
1818,DEPUTADO FEDERAL,ANTONIA GUEDES CABRAL AGUIAR ROCHA,1863
1855,DEPUTADO FEDERAL,ANTONIO CLEDMILSON VIEIRA PINHEIRO,1479
1888,DEPUTADO FEDERAL,CICERO JOHNNY ALVES MOTA,594
1896,DEPUTADO FEDERAL,ADRIANA ALBUQUERQUE DOS SANTOS,236
1900,DEPUTADO FEDERAL,SEBASTIÃO GLEIDISTON DE SOUSA PAIVA,39
1901,DEPUTADO FEDERAL,RAIMUNDO MAGALHÃES FARIAS,313
1907,DEPUTADO FEDERAL,EMMANUEL DE SOUSA AGUIAR,310
1918,DEPUTADO FEDERAL,ADRIANO PEREIRA DA ROCHA,77
1919,DEPUTADO FEDERAL,GILBERTO LINARD ROCHA JÚNIOR,932
1920,DEPUTADO FEDERAL,JOSÉ IZAIAS NEPOMUCENO DE CARVALHO,259
1922,DEPUTADO FEDERAL,RAPHAEL STHEFESON COSTA FONTENELE,393
1923,DEPUTADO FEDERAL,JOÃO LUIZ FELIPE PINHEIRO,389
1924,DEPUTADO FEDERAL,JOICIANA SOUSA MATOS CANUTO,258
1926,DEPUTADO FEDERAL,JOSE DANIEL FERREIRA FONTENELE,219
1933,DEPUTADO FEDERAL,DIANA HELENA SOARES ROCHA MARINHO SARAIVA,192
1944,DEPUTADO FEDERAL,ELIAS MARTINS GOMES,429
1955,DEPUTADO FEDERAL,INÊS DE MELO BRITO,146
1959,DEPUTADO FEDERAL,MARIA ZULEIDE RODRIGUES BRANDÃO,151
1973,DEPUTADO FEDERAL,FRANCISCO WILSON PEREIRA FILHO,380
1974,DEPUTADO FEDERAL,ROSÉLIA FREITAS MARTINS,281
1977,DEPUTADO FEDERAL,ELISABETH BARBOSA MOREIRA,293
1999,DEPUTADO FEDERAL,ANTÔNIO RODRIGUES DA COSTA NETO,110
2000,DEPUTADO FEDERAL,JOSE JERIVAN BRAGA BARROSO,1267
2010,DEPUTADO FEDERAL,JESSICA CARVALHO FREITAS,362
2011,DEPUTADO FEDERAL,OTAVIO LEITE LUSTOSA FILHO,295
2012,DEPUTADO FEDERAL,ISRAEL FROTA DE OLIVEIRA,1797
2015,DEPUTADO FEDERAL,FRANCISCO JOSE DE CARVALHO FERREIRA,315
2020,DEPUTADO FEDERAL,MARIA JULIANA DE LIMA COUTINHO,454
2022,DEPUTADO FEDERAL,CINTHIA BELINO OLIVEIRA DA COSTA,2404
2023,DEPUTADO FEDERAL,ELIANE FRANÇA FERREIRA,315
2026,DEPUTADO FEDERAL,GLENDA MARIA ALVES GARCES SOUSA,388
2033,DEPUTADO FEDERAL,ANDRÉ LUIZ BARBOSA AZEVEDO,1621
2040,DEPUTADO FEDERAL,FRANCISCO GUEDES DA SILVA JÚNIOR,69
2044,DEPUTADO FEDERAL,JOSE GENIVAL DE SOUSA SILVA,19
2055,DEPUTADO FEDERAL,MARIA DO SOCORRO SANTOS DA SILVA,105
2069,DEPUTADO FEDERAL,REGINA DUARTE DA SILVA,1091
2070,DEPUTADO FEDERAL,MARIA OGERLANIA FREITAS RAULINO,12
2077,DEPUTADO FEDERAL,FRANCISCO SERGIO PIRES MONTENEGRO,346
2080,DEPUTADO FEDERAL,MARIA SANDRA DE FREITAS,96
2088,DEPUTADO FEDERAL,MARIA ELIONEIDE RABELO,449
2090,DEPUTADO FEDERAL,INGRID NAYARA DO NASCIMENTO FERNANDES,90
2100,DEPUTADO FEDERAL,MARIA EDIVANIA VIEIRA DA SILVA,988
2123,DEPUTADO FEDERAL,FRANCISCO ROBERTO DOS SANTOS,2591
2200,DEPUTADO FEDERAL,MAYRA ISABEL CORREIA PINHEIRO,71214
2201,DEPUTADO FEDERAL,FRANCISCO DE ASSIS CAVALCANTE NOGUEIRA,24379
2207,DEPUTADO FEDERAL,MARIA ELIANE DO NASCIMENTO CRUZ,257
2208,DEPUTADO FEDERAL,VILMAR DUARTE LEITE,178
2210,DEPUTADO FEDERAL,ANTONIO AGINALDO DE OLIVEIRA,23292
2211,DEPUTADO FEDERAL,YURY BRUNO ALENCAR ARAÚJO,90425
2220,DEPUTADO FEDERAL,FRANCISCO DERIVALDO GONÇALVES LIMA,1220
2222,DEPUTADO FEDERAL,ANDRÉ FERNANDES DE MOURA,229509
2225,DEPUTADO FEDERAL,FRANCISCO DAS CHAGAS RODRIGUES ALVES,1146
2227,DEPUTADO FEDERAL,VERONICA DO AMARAL MADEIRO BATISTA,1020
2233,DEPUTADO FEDERAL,MARIA GORETE PEREIRA,36507
2244,DEPUTADO FEDERAL,TADEU MAGELA DE OLIVEIRA,41093
2255,DEPUTADO FEDERAL,ANTONIO LUIZ RODRIGUES MANO JUNIOR,216531
2256,DEPUTADO FEDERAL,ANTONIO BATISTA MARQUES,810
2266,DEPUTADO FEDERAL,CELSO DOS SANTOS,783
2277,DEPUTADO FEDERAL,JAZIEL PEREIRA DE SOUSA,79358
2288,DEPUTADO FEDERAL,PRISCILA BEZERRA DA COSTA,74773
2299,DEPUTADO FEDERAL,MATHEUS SOARES NORONHA,150823
2300,DEPUTADO FEDERAL,ANDERSON PEROBA GOMES,1495
2313,DEPUTADO FEDERAL,CLÁUDIA CRISTINA DOS SANTOS SANO,436
2323,DEPUTADO FEDERAL,MORONI BING TORGAN,17582
2929,DEPUTADO FEDERAL,LINO ALVES DE ALMEIDA,128
3000,DEPUTADO FEDERAL,SAMUEL LIMA PAULO DO RAMO,4148
3300,DEPUTADO FEDERAL,ALANA MARIA VITORINO ROCHA,1438
3303,DEPUTADO FEDERAL,DANIELE PEREIRA DO NASCIMENTO FORTES CASTELO BRANCO,549
3310,DEPUTADO FEDERAL,MAXWELLMA FRANCO VIEIRA,633
3323,DEPUTADO FEDERAL,EVANDRO DA SILVA PONTES,1728
3333,DEPUTADO FEDERAL,VICENCIA LEANDRO PINHEIRO,1112
3355,DEPUTADO FEDERAL,ALDIZIO ALVES BRITO,191
3378,DEPUTADO FEDERAL,JOÃO PAULO LOPES DOS SANTOS,1202
3380,DEPUTADO FEDERAL,AURELIO JOSÉ JARDIM JERÔNIMO,383
3389,DEPUTADO FEDERAL,JOSÉ SUDERLAN DE CASTRO LIMA,140
3500,DEPUTADO FEDERAL,MARCIO BARROS MAIA,124
3511,DEPUTADO FEDERAL,NUBIA LAFAIETE GONCALVES DA SILVA,170
3535,DEPUTADO FEDERAL,CHISTIANNE MARIA GOMES DE FREITAS,508
3550,DEPUTADO FEDERAL,MANOEL PARENTE DE HOLANDA,343
3555,DEPUTADO FEDERAL,CARLOS ALBERTO FELIX CAVALCANTE,685
3556,DEPUTADO FEDERAL,WILLIAMS DA SILVA BORGES,361
3570,DEPUTADO FEDERAL,JUCILENE FERREIRA DE SOUSA,144
3588,DEPUTADO FEDERAL,CARLOS ANTONIO MARTINS MORAIS,104
3600,DEPUTADO FEDERAL,CAMILLA RAQUEL LEITE DE OLIVEIRA GARCIA,157
3610,DEPUTADO FEDERAL,MARIA DE FÁTIMA BEZERRA SILVA,95
3612,DEPUTADO FEDERAL,JOSÉ IVAN CARNEIRO,281
3615,DEPUTADO FEDERAL,CARLOS ANDRÉ SOARES FERNANDES,378
3620,DEPUTADO FEDERAL,MARIA ZULEIDE ALMEIDA DE SOUSA,81
3622,DEPUTADO FEDERAL,ELANIO PEREIRA DE SOUZA,115
3633,DEPUTADO FEDERAL,FRANCISCO JOZIVAN FELIPE,137
3636,DEPUTADO FEDERAL,RAIMUNDO FLÁVIO FERREIRA FRANÇA,341
3640,DEPUTADO FEDERAL,EDVAN NOGUEIRA BERNARDINO,103
3660,DEPUTADO FEDERAL,FRANCISCA OZILENE PEREIRA NOGUEIRA CARVALHO,68
3680,DEPUTADO FEDERAL,LEONARDO MÁRCIO SANTOS DE MESQUITA,119
3688,DEPUTADO FEDERAL,ADRIANA DE ARAÚJO FERREIRA,54
3690,DEPUTADO FEDERAL,VICENTE CLAUDIO DE MOURA,245
3696,DEPUTADO FEDERAL,JOSÉ IRAPUAN DE MEDEIROS,212
4000,DEPUTADO FEDERAL,DENIS ANDERSON DA ROCHA BEZERRA,118822
4001,DEPUTADO FEDERAL,MARIA ISLANDIA DA COSTA ROCHA,2292
4003,DEPUTADO FEDERAL,LEONIDES AZEVEDO CAVALCANTE,1933
4004,DEPUTADO FEDERAL,LUISA GONÇALVES DA SILVA,542
4010,DEPUTADO FEDERAL,PAULO DE TARSO FACO BEZERRA,2246
4011,DEPUTADO FEDERAL,MARIA GUERRA DE FARIAS,4034
4012,DEPUTADO FEDERAL,ALANDERSON DE CASTRO MANGUEIRA,9043
4013,DEPUTADO FEDERAL,RENATO CÉLIO CHAVES RODRIGUES,4916
4020,DEPUTADO FEDERAL,FRANCISCO EVANDO DELFINO MARREIRO,1446
4022,DEPUTADO FEDERAL,EDUARDO ANDRÉ MAGALHÃES TELES,919
4029,DEPUTADO FEDERAL,ANDREA MAIA LANDIM,3934
4033,DEPUTADO FEDERAL,WASHINGTON SABOIA VITORINO,1177
4040,DEPUTADO FEDERAL,FRANCISCO CARLOS MACEDO TAVARES,5039
4044,DEPUTADO FEDERAL,MARCOS NAUBER FERREIRA ESTACIO,1085
4050,DEPUTADO FEDERAL,HEITOR CLAUDIO PORTELA DE HOLANDA,4711
4051,DEPUTADO FEDERAL,ELZA MARIA BARBOSA ALVES,127
4055,DEPUTADO FEDERAL,FRANCISCO PEREIRA GAMA,1450
4077,DEPUTADO FEDERAL,DANIELE PIMENTEL DE OLIVEIRA,1114
4080,DEPUTADO FEDERAL,CICERO MARCIO BRITO DE OLIVEIRA,314
4085,DEPUTADO FEDERAL,PAULO SALAZAR PRIMO JUNIOR,556
4088,DEPUTADO FEDERAL,MARÍLIA FREIRE PAIVA,4434
4090,DEPUTADO FEDERAL,FRANCISCO DANIEL TEIXEIRA BALBINO,359
4099,DEPUTADO FEDERAL,ALÍPIO RODRIGUES DE OLIVEIRA NETO,3306
4321,DEPUTADO FEDERAL,MARIANA DA SILVA CAVALCANTI,1698
4343,DEPUTADO FEDERAL,RAIMUNDO MARCELO CARVALHO DA SILVA,2567
4400,DEPUTADO FEDERAL,LUIZ CARLOS CARDOSO DO NASCIMENTO JUNIOR,7480
4406,DEPUTADO FEDERAL,FRANCISCO NELHO BEZERRA,3795
4410,DEPUTADO FEDERAL,CARLOS MATOS LIMA,34584
4411,DEPUTADO FEDERAL,VALDERLAN ALVES DE SOUZA,53031
4412,DEPUTADO FEDERAL,PEDRO RIBEIRO FILHO,3545
4420,DEPUTADO FEDERAL,IZAURA TAVARES SOARES,289
4422,DEPUTADO FEDERAL,JULIERME LIMA DE SENA,38619
4423,DEPUTADO FEDERAL,FRANCISCA MARIA DOS SANTOS CABRAL,518
4432,DEPUTADO FEDERAL,MARIA VANESSA SILVA,1051
4433,DEPUTADO FEDERAL,AGRIPINO RODRIGUES GOMES MAGALHAES,12033
4440,DEPUTADO FEDERAL,CAETANO GUEDES NETO,10786
4441,DEPUTADO FEDERAL,HELIO VENTURA DE OLIVEIRA FILHO,2490
4444,DEPUTADO FEDERAL,HEITOR RODRIGO PEREIRA FREIRE,48888
4445,DEPUTADO FEDERAL,DAMIAO SOARES TENORIO,26815
4447,DEPUTADO FEDERAL,FRANCISCO DANILO BASTOS FORTE,88470
4455,DEPUTADO FEDERAL,FRANCISCO VAIDON OLIVEIRA,39203
4456,DEPUTADO FEDERAL,DAYANY BITTENCOURT SANTIL,54526
4466,DEPUTADO FEDERAL,KARLA PATRICIA MATOS CORREIA,1456
4477,DEPUTADO FEDERAL,FERNANDA ENEIDA PESSOA CARACAS DE SOUZA,121469
4488,DEPUTADO FEDERAL,MOSES HAENDEL MELO RODRIGUES,113294
4489,DEPUTADO FEDERAL,REJANE LUZIA OLIVEIRA DE SOUZA,2855
4490,DEPUTADO FEDERAL,NOELIO DA ROCHA OLIVEIRA,42693
4499,DEPUTADO FEDERAL,SAMILA BRAGA CAVALCANTE,1706
4510,DEPUTADO FEDERAL,EMANUELLA DE OLIVEIRA ALVES,219
4511,DEPUTADO FEDERAL,FRANCISCA MARIA FREIRE ALBANO,884
4512,DEPUTADO FEDERAL,RAIMUNDO GERSON DOS SANTOS LIMA,2296
4522,DEPUTADO FEDERAL,ANTONIA JANE MARIA DO VALE MAIA,155
4530,DEPUTADO FEDERAL,EDSON BEZERRA DA COSTA,676
4533,DEPUTADO FEDERAL,TERESINHA DA SILVA FERREIRA,644
4545,DEPUTADO FEDERAL,FRANCISCO WILTON DE ALMEIDA,201
4554,DEPUTADO FEDERAL,ANTONIO AUGUSTO FIGUEIREDO LIMA FILHO,180
4555,DEPUTADO FEDERAL,REGINA CLÁUDIA TABOSA FERREIRA GOMES,16110
4564,DEPUTADO FEDERAL,ANA VALÉRIA ALMEIDA DE BRITO,213
4565,DEPUTADO FEDERAL,PAULO ROMERITO DE ARAUJO MONTENEGRO,345
4567,DEPUTADO FEDERAL,JOSÉ DENÍSIO PINHEIRO,8085
4568,DEPUTADO FEDERAL,JOSE GERALDO ARAUJO CORREIA,133
4578,DEPUTADO FEDERAL,CARLOS EMANUEL ARAUJO MENDONÇA DE ALENCAR,483
4599,DEPUTADO FEDERAL,FRANCISCO FEITOSA DE ALBUQUERQUE LIMA,390
5000,DEPUTADO FEDERAL,JANAÍNA ARAUJO DE OLIVEIRA,555
5001,DEPUTADO FEDERAL,JOÃO ALFREDO TELLES MELO,18843
5005,DEPUTADO FEDERAL,ANNA KARINA CAVALCANTE DE OLIVEIRA,9512
5007,DEPUTADO FEDERAL,MAYA ELIZ SOUSA LIMA,4111
5010,DEPUTADO FEDERAL,AIRTON GLEISSON TEIXEIRA LIMA,779
5013,DEPUTADO FEDERAL,ADELITTA MONTEIRO NUNES,20806
5020,DEPUTADO FEDERAL,PAULO RUBENS BARBOSA FRANÇA,1166
5030,DEPUTADO FEDERAL,CLEONICE PEREIRA DE SOUSA,177
5032,DEPUTADO FEDERAL,CLÁUDIO OLIVEIRA LIMA JÚNIOR,101
5044,DEPUTADO FEDERAL,ANA LIDIA RODRIGUES LIMA,7072
5050,DEPUTADO FEDERAL,AILTON CLAÉCIO LOPES DANTAS,16052
5055,DEPUTADO FEDERAL,GABRIEL LIMA DE AGUIAR,38277
5060,DEPUTADO FEDERAL,CRISTIANO ALMEIDA NUNES,109
5078,DEPUTADO FEDERAL,PEDRO WILSON DE SOUSA OLIVEIRA,788
5080,DEPUTADO FEDERAL,FRANCISCO ALAN DE AMORIM QUINTELA,500
5088,DEPUTADO FEDERAL,ROBERTA MENEZES SOUSA,1505
5098,DEPUTADO FEDERAL,RAIMUNDO NONATO DA ROCHA FRANCO,61
5099,DEPUTADO FEDERAL,DAMIÃO AMÂNCIO DA SILVA,1221
5100,DEPUTADO FEDERAL,FRANCISCO FARIAS DO RÊGO,151
5110,DEPUTADO FEDERAL,CLÁUDIO SARMENTO AMADO,49
5111,DEPUTADO FEDERAL,CARLOS ALBERTO GUILHERME CAVALCANTE FILHO,330
5115,DEPUTADO FEDERAL,CARLOS MAGNO DE ALMEIDA,138
5116,DEPUTADO FEDERAL,ANDRÉ DO NASCIMENTO FARIAS,276
5118,DEPUTADO FEDERAL,RONALDO VIEIRA DA SILVA,48
5120,DEPUTADO FEDERAL,ANA MARIA MARTINS SANTOS,257
5121,DEPUTADO FEDERAL,ANTONIO CESAR DO NASCIMENTO SOUSA,154
5122,DEPUTADO FEDERAL,LINDOMAR BARBOSA DE MESQUITA,518
5123,DEPUTADO FEDERAL,ANTONIO GUEDES CAVALCANTE JÚNIOR,485
5133,DEPUTADO FEDERAL,ANTONIO NIERTON QUEIROZ GUERRA,538
5144,DEPUTADO FEDERAL,ERACISO DE OLIVEIRA BRAGA,229
5151,DEPUTADO FEDERAL,ROSILANE DE SOUSA SILVA,150
5169,DEPUTADO FEDERAL,ALZERMIRIAN ALVES FREITAS,62
5177,DEPUTADO FEDERAL,CÉSAR FLÔR FRANCO,606
5188,DEPUTADO FEDERAL,MARIA DE FÁTIMA COSTA CAVALCANTE,121
5199,DEPUTADO FEDERAL,ADRIANA ALVES LUCIO,83
5500,DEPUTADO FEDERAL,NAUMI GOMES DE AMORIM,34214
5501,DEPUTADO FEDERAL,ROSA MARIA MOURA ROCHA,970
5511,DEPUTADO FEDERAL,CÉLIO STUDART BARBOSA,205106
5512,DEPUTADO FEDERAL,LUCIANO DE MELO SOUSA,356
5515,DEPUTADO FEDERAL,FABIANO MAGALHÃES DE MESQUITA,2189
5517,DEPUTADO FEDERAL,DANIEL VICTOR LIMA GONÇALVES,5603
5522,DEPUTADO FEDERAL,MARCOS ANTONIO MORAES LIMA,3272
5533,DEPUTADO FEDERAL,LUIZ GASTÃO BITTENCOURT DA SILVA,96537
5544,DEPUTADO FEDERAL,PAULO HENRIQUE DA SILVA LEÃO,1926
5555,DEPUTADO FEDERAL,DOMINGOS GOMES DE AGUIAR NETO,175074
5557,DEPUTADO FEDERAL,GIOVANNI SAMPAIO GONDIM,50
5566,DEPUTADO FEDERAL,KELVYA COSTA ALBUQUERQUE,2313
5567,DEPUTADO FEDERAL,GERALDO AMANCIO PEREIRA,3248
5575,DEPUTADO FEDERAL,ISABEL MARIA SILVA BRAGA,780
5577,DEPUTADO FEDERAL,MARIA JOSÉ MAIA,9184
5578,DEPUTADO FEDERAL,JAQUELINE ALVES DANTAS,253
5588,DEPUTADO FEDERAL,FRANCISCA ELIANE BRAZ DE CARVALHO,65958
5590,DEPUTADO FEDERAL,ELIESIO ROCHA ADRIANO,1471
5599,DEPUTADO FEDERAL,EMANUEL MAIA MOTA,6908
6513,DEPUTADO FEDERAL,FRANCISCA HELENA FERNANDES FRANCA,511
6565,DEPUTADO FEDERAL,INÁCIO FRANCISCO DE ASSIS NUNES ARRUDA,47672
7000,DEPUTADO FEDERAL,FRANCISCO EDIVAN NONATO DA SILVA,2118
7001,DEPUTADO FEDERAL,JOSÉ MARIA DO NASCIMENTO,467
7007,DEPUTADO FEDERAL,CARLOS EDUARDO MARTINS TORRES,1374
7011,DEPUTADO FEDERAL,MARCOS ANTÔNIO DE ARAÚJO MENDONÇA,2265
7012,DEPUTADO FEDERAL,LURDENIS DE ALENCAR VIEIRA,1567
7013,DEPUTADO FEDERAL,JOSÉ WILSON DE MELO,3227
7020,DEPUTADO FEDERAL,LÍVIA MOURA ROSADO KALUME REIS,444
7022,DEPUTADO FEDERAL,RAIMUNDO ANSELMO LIMA MORORO,585
7030,DEPUTADO FEDERAL,JOSÉ MONTEIRO PRIMO DA PAZ,201
7033,DEPUTADO FEDERAL,AIRTON DA SILVA,2055
7040,DEPUTADO FEDERAL,FRANCISCO ANTÔNIO PEREIRA GOMES,6571
7044,DEPUTADO FEDERAL,ANTÔNIO PIERRE AGUIAR NETO,1273
7055,DEPUTADO FEDERAL,MARIA AURI AMORIM DE PAULA,474
7060,DEPUTADO FEDERAL,FRANCISCO HERMANO LEANDRO DA SILVA GOMES,445
7069,DEPUTADO FEDERAL,CIRO ALBUQUERQUE MARQUES,2391
7070,DEPUTADO FEDERAL,JOSÉ ALEXANDRE OLIVEIRA SOBREIRA,2220
7077,DEPUTADO FEDERAL,MÔNICA SILVA SANTOS DE SOUSA,358
7078,DEPUTADO FEDERAL,JOSÉ VALBERTO LEITE ESMERALDO,751
7080,DEPUTADO FEDERAL,DIMAS MATIAS DA SILVA,2200
7088,DEPUTADO FEDERAL,MARIA CLEANES DA SILVA,422
7089,DEPUTADO FEDERAL,JOÃO VERÍSSIMO DE MORAIS NETO,660
7090,DEPUTADO FEDERAL,MARIA DALILA DE SOUZA FERNANDES,661
7099,DEPUTADO FEDERAL,LUCIVANIA RODRIGUES,625
8080,DEPUTADO FEDERAL,LINIK SUED CARVALHO DA MOTA,2140
9000,DEPUTADO FEDERAL,MANOEL ALVES DE OLIVEIRA,643
9001,DEPUTADO FEDERAL,ARTUR CORREIA LIMA NETO,281
9010,DEPUTADO FEDERAL,VALMIR DOS SANTOS SILVA,114
9013,DEPUTADO FEDERAL,CARLOS KENNEDY ALMEIDA LOPES,16
9014,DEPUTADO FEDERAL,HUGO CEZAR DAMASCENO DE SOUSA,251
9017,DEPUTADO FEDERAL,SUZANE VIANA MOREIRA,100
9026,DEPUTADO FEDERAL,ROZANE DIAS DE SENA,53
9030,DEPUTADO FEDERAL,NARLIA GADELHA DE OLIVEIRA,46
9038,DEPUTADO FEDERAL,GABRIEL LEANDRO CABRAL DE OLIVEIRA,28
9060,DEPUTADO FEDERAL,REGINA CELLE DE BRITO TAVARES,89
9070,DEPUTADO FEDERAL,JANEDSON BRAGA DA SILVA,190
9087,DEPUTADO FEDERAL,FRANCISCA IDALBA TEIXEIRA DE OLIVEIRA,44
9088,DEPUTADO FEDERAL,FRANCISCO MAURICIO DA COSTA,48
9090,DEPUTADO FEDERAL,ANTONIO ADILSON EUFRASINO DE PINHO,1775
