NR_VOTAVEL,DS_CARGO,NM_VOTAVEL,QT_VOTOS
10,DEPUTADO FEDERAL,REPUBLICANOS,3968
11,DEPUTADO FEDERAL,PROGRESSISTAS,2654
12,DEPUTADO FEDERAL,Partido Democrático Trabalhista,3353
13,DEPUTADO FEDERAL,Partido dos Trabalhadores,16837
14,DEPUTADO FEDERAL,Partido Trabalhista Brasileiro,789
15,DEPUTADO FEDERAL,Movimento Democrático Brasileiro,4313
16,DEPUTADO FEDERAL,Partido Socialista dos Trabalhadores Unificado,137
18,DEPUTADO FEDERAL,Rede Sustentabilidade,396
19,DEPUTADO FEDERAL,Podemos,634
20,DEPUTADO FEDERAL,Partido Social Cristão,1058
22,DEPUTADO FEDERAL,Partido Liberal,10756
23,DEPUTADO FEDERAL,Cidadania,946
27,DEPUTADO FEDERAL,Democracia Cristã,107
28,DEPUTADO FEDERAL,Partido Renovador Trabalhista Brasileiro,355
29,DEPUTADO FEDERAL,Partido da Causa Operária,73
30,DEPUTADO FEDERAL,Partido Novo,2841
33,DEPUTADO FEDERAL,Partido da Mobilização Nacional,752
36,DEPUTADO FEDERAL,AGIR,1713
40,DEPUTADO FEDERAL,Partido Socialista Brasileiro,1539
43,DEPUTADO FEDERAL,Partido Verde,1229
44,DEPUTADO FEDERAL,UNIÃO BRASIL,1931
45,DEPUTADO FEDERAL,Partido da Social Democracia Brasileira,1040
50,DEPUTADO FEDERAL,Partido Socialismo e Liberdade,1763
51,DEPUTADO FEDERAL,Patriota,755
55,DEPUTADO FEDERAL,Partido Social Democrático,2223
65,DEPUTADO FEDERAL,Partido Comunista do Brasil,197
70,DEPUTADO FEDERAL,AVANTE,830
77,DEPUTADO FEDERAL,Solidariedade,261
80,DEPUTADO FEDERAL,Unidade Popular,87
90,DEPUTADO FEDERAL,Partido Republicano da Ordem Social,487
95,DEPUTADO FEDERAL,VOTO BRANCO,114654
96,DEPUTADO FEDERAL,VOTO NULO,56923
1000,DEPUTADO FEDERAL,PAULO FERNANDO MELO DA COSTA,15992
1010,DEPUTADO FEDERAL,JULIO CESAR RIBEIRO,76274
1011,DEPUTADO FEDERAL,SILMARA BEZERRA MIRANDA,2720
1015,DEPUTADO FEDERAL,GILVAM MAXIMO,20923
1020,DEPUTADO FEDERAL,DAVYS FREDERICO TEIXEIRA LINHARES,165358
1022,DEPUTADO FEDERAL,ELISANGELA MACHADO DOS SANTOS DE FREITAS,2422
1033,DEPUTADO FEDERAL,SERGIO FERNANDO PEDROSO ABOUD,3492
1077,DEPUTADO FEDERAL,ADILA MARIA STEMLER,3068
1099,DEPUTADO FEDERAL,FABIANO GUIMARÃES DA ROCHA,7090
1100,DEPUTADO FEDERAL,MARCOS ANTONIO DOMINGOS,1385
1110,DEPUTADO FEDERAL,SAMANTHA RIBEIRO MEYER PFLUG MARQUES,6262
1111,DEPUTADO FEDERAL,RONEY TANIOS NEMER,46151
1122,DEPUTADO FEDERAL,RONALDO FONSECA DE SOUZA,13687
1123,DEPUTADO FEDERAL,CELY LANGAMER MUNIZ,716
1144,DEPUTADO FEDERAL,WILL GODOY RODRIGUES,3068
1155,DEPUTADO FEDERAL,ROGERIO SCHUMANN ROSSO,14210
1161,DEPUTADO FEDERAL,CARINA SALES DOS SANTOS,892
1177,DEPUTADO FEDERAL,JOSE GOMES FERREIRA FILHO,28528
1200,DEPUTADO FEDERAL,MARLENE DE JESUS ABREU,499
1207,DEPUTADO FEDERAL,TÂNIA ALVES COÊLHO,419
1211,DEPUTADO FEDERAL,VANDEILDO LOPES DE GOIS,619
1212,DEPUTADO FEDERAL,VALBERTO FERREIRA PINTO,863
1221,DEPUTADO FEDERAL,CARLOS PENNA BRESCIANINI,822
1222,DEPUTADO FEDERAL,EUCLIDES FERREIRA DE ASSUNÇÃO,470
1223,DEPUTADO FEDERAL,ROBERTA DE CAMARGO,297
1234,DEPUTADO FEDERAL,DENISE MARIA DE FRANCO SOUZA,1408
1277,DEPUTADO FEDERAL,MAX MAURAN PANTOJA DA COSTA,763
1310,DEPUTADO FEDERAL,AGNELO SANTOS QUEIROZ FILHO,5223
1313,DEPUTADO FEDERAL,ROBERTO POLICARPO FAGUNDES,22608
1324,DEPUTADO FEDERAL,VANESSA NEGRINI,10816
1331,DEPUTADO FEDERAL,ERIKA JUCÁ KOKAY,146092
1361,DEPUTADO FEDERAL,ERIVAN HILÁRIO DOS SANTOS,31538
1400,DEPUTADO FEDERAL,DIEGO LUIZ DE SOUSA ARRUDA,447
1414,DEPUTADO FEDERAL,MARCOS ARAUJO DE MIRANDA,223
1422,DEPUTADO FEDERAL,IVONE ARMANDO LUZARDO DE SOUSA,943
1440,DEPUTADO FEDERAL,NOEME DE OLIVEIRA DA SILVA,306
1441,DEPUTADO FEDERAL,IRACEMA MARIA DURÃO MOREIRA,211
1454,DEPUTADO FEDERAL,PAUL KARSTEN GALLEGUILLOS KEMPF DE FARIAS,374
1456,DEPUTADO FEDERAL,ODISSÉIA SÂNIA RODRIGUES E SILVA,79
1477,DEPUTADO FEDERAL,PAULO ROBERTO RIBEIRO DA ROCHA,865
1498,DEPUTADO FEDERAL,JOSE DE PAIVA MACIEL,311
1500,DEPUTADO FEDERAL,AMANDA RAMALHO DE OLIVEIRA,1401
1501,DEPUTADO FEDERAL,MARLI RODRIGUES,7873
1515,DEPUTADO FEDERAL,RAFAEL CAVALCANTI PRUDENTE,121307
1522,DEPUTADO FEDERAL,JANIO FARIAS MARQUES,5102
1525,DEPUTADO FEDERAL,FABIO PEREIRA DE SOUSA,7047
1551,DEPUTADO FEDERAL,ALIRIO DE OLIVEIRA NETO,10079
1555,DEPUTADO FEDERAL,ZÉLIO MAIA DA ROCHA,1028
1567,DEPUTADO FEDERAL,CAROLINA MOURÃO ALBUQUERQUE,1640
1590,DEPUTADO FEDERAL,MARCIO CAVALCANTE DE VASCONCELOS,3363
1600,DEPUTADO FEDERAL,EVERTON SALVADOR DA SILVA,95
1616,DEPUTADO FEDERAL,TÂNIA DE SOUSA LIMA,209
1800,DEPUTADO FEDERAL,ROBERTO CABRAL BORGES,2917
1818,DEPUTADO FEDERAL,ALDEMARIO ARAUJO CASTRO,1160
1881,DEPUTADO FEDERAL,LAURIANNE DE MIRANDA GOMES,1318
1900,DEPUTADO FEDERAL,CRISTIANE MARY OTAVIANO DE ALMEIDA DOS SANTOS,490
1919,DEPUTADO FEDERAL,GERALDO ANTÔNIO DE CASTRO,375
1920,DEPUTADO FEDERAL,PAULO CHAGAS,2572
1921,DEPUTADO FEDERAL,ADALBERTO MONTEIRO,962
1973,DEPUTADO FEDERAL,VALDIVINA PEREIRA DA CONCEIÇÃO ALMEIDA,201
1979,DEPUTADO FEDERAL,PAULO RODRIGUES LIMA,130
1988,DEPUTADO FEDERAL,REGIS SOARES MACHADO,829
1991,DEPUTADO FEDERAL,CAROLINE DIAS RIBEIRO,285
1999,DEPUTADO FEDERAL,MANOEL WAGNER ALVINO ALVES,3038
2000,DEPUTADO FEDERAL,VANDERLEI MACIEL LIMA,773
2002,DEPUTADO FEDERAL,GLAUCE CANDIDA LOPES FRANCO,164
2019,DEPUTADO FEDERAL,LUCIANO ALVES DA COSTA SANTOS,979
2020,DEPUTADO FEDERAL,ALESSANDRA ALMEIDA CHIANELLI DUTRA,589
2022,DEPUTADO FEDERAL,ANA PAULA BATISTA SOLEDADE,1464
2033,DEPUTADO FEDERAL,IVAN JOSÉ DE ALMEIDA JUNIOR,273
2044,DEPUTADO FEDERAL,RAFAEL LIMA FREIRE,731
2077,DEPUTADO FEDERAL,LUCIANO NAZARIO FEITOZA,480
2099,DEPUTADO FEDERAL,PAULO ROBERTO SANTOS DA CUNHA,769
2200,DEPUTADO FEDERAL,JOSÉ ROBERTO ARRUDA,17016
2211,DEPUTADO FEDERAL,VINÍCIUS SANTANA ROSSIGNOLI,1029
2222,DEPUTADO FEDERAL,BEATRIZ KICIS TORRENTS DE SORDI,214733
2223,DEPUTADO FEDERAL,MARIA ANGÉLICA BRITO MACHADO,1977
2225,DEPUTADO FEDERAL,JOÃO ALBERTO FRAGA SILVA,28825
2228,DEPUTADO FEDERAL,MARCO AURELIO COSTA,1458
2233,DEPUTADO FEDERAL,RAFAEL DE SÁ SAMPAIO,11762
2238,DEPUTADO FEDERAL,DAVI LIMA SOUSA,3826
2261,DEPUTADO FEDERAL,ANNEBELLE FERREIRA BORGES,1130
2300,DEPUTADO FEDERAL,MARCILENE LIMA DE SOUZA,251
2311,DEPUTADO FEDERAL,LEANDRO DE LIMA LIRA,382
2322,DEPUTADO FEDERAL,HOSANA DO NASCIMENTO CARDOSO,430
2323,DEPUTADO FEDERAL,FRANCISCO DE SOUSA ANDRADE,916
2324,DEPUTADO FEDERAL,MARIANA VALENTIM DE OLIVEIRA SILVA,1058
2325,DEPUTADO FEDERAL,LIDIANE DIAS DE MORAES DOS SANTOS,277
2700,DEPUTADO FEDERAL,LUCINEIDE MARIA DA SILVA LIMA,611
2707,DEPUTADO FEDERAL,MARIA MAECÉ FERREIRA BORGES,112
2717,DEPUTADO FEDERAL,SEBASTIAO JOSE DE SANTANA,339
2722,DEPUTADO FEDERAL,LUIZ GONZAGA DE ANDRADE COSTA DE FRANÇA,359
2727,DEPUTADO FEDERAL,JOSE OSCAR DA SILVA,1448
2733,DEPUTADO FEDERAL,CRISTIAN DE OLIVEIRA LIMA,48
2772,DEPUTADO FEDERAL,PAULO HENRIQUE DE OLIVEIRA MELO,274
2777,DEPUTADO FEDERAL,IVONE LOPES DE CARVALHO,244
2799,DEPUTADO FEDERAL,ANTONIO JOAQUIM DE SOUZA,274
2820,DEPUTADO FEDERAL,MARIA DAS GRAÇAS MOREIRA NASCIMENTO,220
2822,DEPUTADO FEDERAL,KOE KENDY UYARA,77
2829,DEPUTADO FEDERAL,DILMAR NUNES DE CARVALHO,122
2919,DEPUTADO FEDERAL,URIEL SCHRAMM ROITMAN,50
2929,DEPUTADO FEDERAL,RICARDO DE SOUSA MACHADO,118
2939,DEPUTADO FEDERAL,ANA SCHRAMM,113
2949,DEPUTADO FEDERAL,MARILIA VIEIRA MARQUES,139
2999,DEPUTADO FEDERAL,IERI DE SOUSA BRAGA JUNIOR,53
3000,DEPUTADO FEDERAL,PAULO ROBERTO ROQUE ANTONIO KHOURI,18811
3001,DEPUTADO FEDERAL,JOSÉ FERREIRA NETO,214
3020,DEPUTADO FEDERAL,VALTER SOARES SABOIA,900
3030,DEPUTADO FEDERAL,RITA DE CÁSSIA ANTUNES GOMES MASCARENHAS,1817
3033,DEPUTADO FEDERAL,ELAYNE CRISTINA CACHEN GUIMARAES PINHEIRO RATTES,3026
3066,DEPUTADO FEDERAL,JORGE ERNESTO SANCHEZ RUIZ,342
3300,DEPUTADO FEDERAL,FRANCISCO PEREIRA DE SOUSA,1268
3310,DEPUTADO FEDERAL,MONICA VITORIA DOS SANTOS DA COSTA,779
3313,DEPUTADO FEDERAL,JOÃO LIMA FILHO,428
3322,DEPUTADO FEDERAL,TÁCIO ROGÉRIO ALLAN PONTES,926
3326,DEPUTADO FEDERAL,NIVALDO DE OLIVEIRA,431
3333,DEPUTADO FEDERAL,ADERIVALDO MARTINS CARDOSO,1455
3345,DEPUTADO FEDERAL,MARIA ROSA RODRIGUES MARINO CRUZEIRO,1172
3361,DEPUTADO FEDERAL,CLEUSA SOUZA VASCONCELOS,174
3377,DEPUTADO FEDERAL,ANA ELIZA CAMARGO CHACEL,160
3600,DEPUTADO FEDERAL,RAFAEL LOBO DANTAS,1869
3617,DEPUTADO FEDERAL,ELIS NAIR DA PENHA GONÇALVES,11
3622,DEPUTADO FEDERAL,EMY APARECIDA DA SILVA LEITÃO,859
3633,DEPUTADO FEDERAL,HEWERT RITCHARD DE MELO,353
3636,DEPUTADO FEDERAL,ADELSON FELIZARDO DA SILVA,627
3669,DEPUTADO FEDERAL,RIVANE LUCENA MELO PEDRA,53
3677,DEPUTADO FEDERAL,SELMA APARECIDA DA COSTA DOS SANTOS,1085
3688,DEPUTADO FEDERAL,ALEX ALVES NEVES,866
3699,DEPUTADO FEDERAL,ATILA MAIA DA ROCHA,377
4000,DEPUTADO FEDERAL,ANA PAULA BENETE CROZUÉ,1589
4017,DEPUTADO FEDERAL,MARCOS VINICIOS DE JESUS MORAIS,5239
4022,DEPUTADO FEDERAL,MARCOS WESLEY DE SOUSA FEITOSA,29870
4040,DEPUTADO FEDERAL,RODRIGO SOBRAL ROLLEMBERG,51926
4044,DEPUTADO FEDERAL,ESTEVÃO CARVALHO LOPES,1492
4050,DEPUTADO FEDERAL,LARISSA SCHMIDT,611
4055,DEPUTADO FEDERAL,ADNA SANTOS DE ARAÚJO,3050
4067,DEPUTADO FEDERAL,FRANCISCO CRISTIANO LOPES,595
4077,DEPUTADO FEDERAL,ISRAEL MATOS BATISTA,40885
4321,DEPUTADO FEDERAL,LOUISE FERREIRA DE SOUZA,802
4343,DEPUTADO FEDERAL,REGINALDO VERAS COELHO,54557
4400,DEPUTADO FEDERAL,ELIANA MARIA PASSOS PEDROSA,23453
4401,DEPUTADO FEDERAL,RENILSON SANTOS DE ROMA,7129
4411,DEPUTADO FEDERAL,FLÁVIO WERNECK MENEGUELLI,4716
4422,DEPUTADO FEDERAL,FADI FAYEZ FARAJ,14670
4433,DEPUTADO FEDERAL,ELISEU KADESH ROSA ASSUNÇÃO,3253
4440,DEPUTADO FEDERAL,MARIA DO SANTO COSTA SOUSA,5629
4444,DEPUTADO FEDERAL,RODRIGO RODRIGUES FERREIRA GOMES,2637
4445,DEPUTADO FEDERAL,SÉRGIO RONALDO SACE BAUTZER DOS SANTOS FILHO,1472
4455,DEPUTADO FEDERAL,JÚLIA LUCY MARQUES ARAÚJO,20021
4500,DEPUTADO FEDERAL,KARLA VINHAS DE JESUS,1436
4545,DEPUTADO FEDERAL,ANDRÉIA MOURA ZEMUNER,2398
4555,DEPUTADO FEDERAL,LEANDRO NARDY DE ALMEIDA,671
5000,DEPUTADO FEDERAL,DANIELLE DE PAULA BENÍCIO DA SILVA,8958
5010,DEPUTADO FEDERAL,ROSELI FARIA,4820
5013,DEPUTADO FEDERAL,RAPHAEL SEBBA DAHER FLEURY CURADO,15050
5050,DEPUTADO FEDERAL,MARIA FÁTIMA DE SOUSA,7989
5088,DEPUTADO FEDERAL,MARIA EDUARDA KRASNY DE SOUZA DA SILVA,2202
5099,DEPUTADO FEDERAL,THIAGO DE ÁVILA E SILVA OLIVEIRA,5516
5107,DEPUTADO FEDERAL,DANIELA CINTRA RODRIGUES,143
5111,DEPUTADO FEDERAL,SIDRAQUE PINHEIRO DA SILVA,574
5118,DEPUTADO FEDERAL,MARIA CÍCERA SALUSTRIANO CAETANO,541
5123,DEPUTADO FEDERAL,CARLOS ENOCK RODRIGUES ESTEVES,164
5125,DEPUTADO FEDERAL,DANIELLE CRISTHIE GOMES RIBEIRO LIMA SALES,78
5150,DEPUTADO FEDERAL,NÉSIO OLIVEIRA SILVA,176
5151,DEPUTADO FEDERAL,VICTOR OKUBO AGUIAR,1332
5152,DEPUTADO FEDERAL,MARCELO RIBEIRO ARTIAGA,48
5501,DEPUTADO FEDERAL,SHEYLA SOARES SAMPAIO,996
5511,DEPUTADO FEDERAL,ADRIANA MANGABEIRA WANDERLEY,349
5522,DEPUTADO FEDERAL,CHARLES DE MAGALHAES ARAUJO JUNIOR,2290
5544,DEPUTADO FEDERAL,WILBERT GOLDEN BATISTA,23879
5551,DEPUTADO FEDERAL,GILCILENE MARIA DOS SANTOS,4441
5555,DEPUTADO FEDERAL,ANDRÉ OCTÁVIO KUBITSCHEK BARBARA ALVES PEREIRA,20702
5561,DEPUTADO FEDERAL,VIRGÍLIO DO REGO MONTEIRO NETO,9071
5566,DEPUTADO FEDERAL,PEDRO HENRIQUE VIEGAS DE OLIVEIRA,6112
5590,DEPUTADO FEDERAL,NEVITON PEREIRA JUNIOR,1407
6565,DEPUTADO FEDERAL,ANA MARIA PRESTES RABELO,5531
6599,DEPUTADO FEDERAL,FLAUZINO ANTUNES NETO,797
7007,DEPUTADO FEDERAL,HEMERSON DOS SANTOS LUZ,1256
7010,DEPUTADO FEDERAL,PAULO SERGIO BARBOSA DE SÁ,3081
7011,DEPUTADO FEDERAL,ELIED BARBOSA DE OLIVEIRA,591
7022,DEPUTADO FEDERAL,CARLOS SHIGUEO KOBAYASHI,493
7026,DEPUTADO FEDERAL,LUIZ CARLOS ROCHA DA SILVA,2352
7033,DEPUTADO FEDERAL,GISELLE RHAYLLA ANDRADE DE OLIVEIRA,667
7040,DEPUTADO FEDERAL,AMANDA CHRISTINA CABRAL BERTIN,1580
7070,DEPUTADO FEDERAL,ELIZEU DE SOUZA,2111
7090,DEPUTADO FEDERAL,MARIA CLARETE PEREIRA DOS SANTOS BARBOSA,439
7710,DEPUTADO FEDERAL,RODRIGO ANTONIO LOPES BELCHIOR,2736
7722,DEPUTADO FEDERAL,HELIO FRANCISCO DA CRUZ,432
7733,DEPUTADO FEDERAL,FERNANDO FRANCISCO DA SILVA DE SOUZA,172
7757,DEPUTADO FEDERAL,VIVIANE ALVES RODRIGUES FREITAS,331
7761,DEPUTADO FEDERAL,WILMA MARIA SILVA DE MENEZES,633
7770,DEPUTADO FEDERAL,CLODOALDO BATISTA NERI JUNIOR,116
7777,DEPUTADO FEDERAL,RODOLPHO HOTH DOS REIS,478
7788,DEPUTADO FEDERAL,LIGIA BEATRIZ AMORIM AMARAL,234
7790,DEPUTADO FEDERAL,JANISIO BARBOSA DO NASCIMENTO MELO,301
8080,DEPUTADO FEDERAL,CAIO SAD BARBOSA,1472
9000,DEPUTADO FEDERAL,MÁRCIA VALÉRIA CHAVES DE HOLANDA FERREIRA,615
9009,DEPUTADO FEDERAL,ANTONIO HENRIQUE SANTOS RESENDE,366
9010,DEPUTADO FEDERAL,JULIA RODRIGUES MONTEIRO BARROS,362
9015,DEPUTADO FEDERAL,SEVERINO CAJAZEIRAS DE SOUSA OLIVEIRA,2795
9022,DEPUTADO FEDERAL,FRANCISCO MOTA CRUVINEL,112
9023,DEPUTADO FEDERAL,BETHANIA KELLY DE ALMEIDA BARBOSA NOGUEIRA,153
9033,DEPUTADO FEDERAL,LUIZ RAIMUNDO DE OLIVEIRA,52
9061,DEPUTADO FEDERAL,ANTONIO FERNANDO DANTAS DOS SANTOS,364
9090,DEPUTADO FEDERAL,ANTONIO AMAURI MALAQUIAS DE PINHO,571
