NR_VOTAVEL,DS_CARGO,NM_VOTAVEL,QT_VOTOS
10,DEPUTADO FEDERAL,REPUBLICANOS,3720
11,DEPUTADO FEDERAL,PROGRESSISTAS,6135
12,DEPUTADO FEDERAL,Partido Democrático Trabalhista,25185
13,DEPUTADO FEDERAL,Partido dos Trabalhadores,91245
14,DEPUTADO FEDERAL,Partido Trabalhista Brasileiro,7395
15,DEPUTADO FEDERAL,Movimento Democrático Brasileiro,6762
16,DEPUTADO FEDERAL,Partido Socialista dos Trabalhadores Unificado,1282
18,DEPUTADO FEDERAL,Rede Sustentabilidade,1495
19,DEPUTADO FEDERAL,Podemos,2671
20,DEPUTADO FEDERAL,Partido Social Cristão,1799
21,DEPUTADO FEDERAL,Partido Comunista Brasileiro,2940
22,DEPUTADO FEDERAL,Partido Liberal,89834
23,DEPUTADO FEDERAL,Cidadania,2619
27,DEPUTADO FEDERAL,Democracia Cristã,981
28,DEPUTADO FEDERAL,Partido Renovador Trabalhista Brasileiro,1085
29,DEPUTADO FEDERAL,Partido da Causa Operária,390
30,DEPUTADO FEDERAL,Partido Novo,21141
33,DEPUTADO FEDERAL,Partido da Mobilização Nacional,1856
35,DEPUTADO FEDERAL,Partido da Mulher Brasileira,753
36,DEPUTADO FEDERAL,AGIR,1507
40,DEPUTADO FEDERAL,Partido Socialista Brasileiro,10598
43,DEPUTADO FEDERAL,Partido Verde,1989
44,DEPUTADO FEDERAL,UNIÃO BRASIL,10152
45,DEPUTADO FEDERAL,Partido da Social Democracia Brasileira,3890
50,DEPUTADO FEDERAL,Partido Socialismo e Liberdade,12189
51,DEPUTADO FEDERAL,Patriota,3067
55,DEPUTADO FEDERAL,Partido Social Democrático,8877
65,DEPUTADO FEDERAL,Partido Comunista do Brasil,2009
70,DEPUTADO FEDERAL,AVANTE,1130
77,DEPUTADO FEDERAL,Solidariedade,4047
90,DEPUTADO FEDERAL,Partido Republicano da Ordem Social,1890
95,DEPUTADO FEDERAL,VOTO BRANCO,616380
96,DEPUTADO FEDERAL,VOTO NULO,600046
1000,DEPUTADO FEDERAL,MARCELO BEZERRA CRIVELLA,110450
1001,DEPUTADO FEDERAL,LUIZ ANTONIO RODRIGUES VIEIRA,2254
1002,DEPUTADO FEDERAL,THIAGO DE OLIVEIRA XAVIER ROCHA,3021
1003,DEPUTADO FEDERAL,ARLEAN GOMES BUENO,974
1004,DEPUTADO FEDERAL,PEDRO FERNANDO DE SOUZA ALVES,6286
1006,DEPUTADO FEDERAL,ANTONIO AUGUSTO CRUZ RIBEIRO JUNIOR,3870
1007,DEPUTADO FEDERAL,EDUARDO RIBEIRO DA SILVA,5244
1008,DEPUTADO FEDERAL,ANTONIA FONTENELE DE BRITO,30975
1010,DEPUTADO FEDERAL,LUIS CARLOS GOMES DA SILVA,57670
1011,DEPUTADO FEDERAL,JORGE BRAZ DE OLIVEIRA,59201
1012,DEPUTADO FEDERAL,MARCIO JOSE CORREA ALVES,4397
1013,DEPUTADO FEDERAL,LUCIANA MARTINS CALACA,1321
1015,DEPUTADO FEDERAL,EZEQUIEL DOMINGUES LOURENÇO,2154
1016,DEPUTADO FEDERAL,EDUARDO TORRES DE LEMOS,1992
1017,DEPUTADO FEDERAL,ALCIO PEREIRA,1639
1019,DEPUTADO FEDERAL,MONICA GERMANO CURY DE SOUZA,594
1020,DEPUTADO FEDERAL,JOSÉ MARQUES ANDRÉ NETO,5168
1021,DEPUTADO FEDERAL,SANDOCLEY QUEIROZ DE AZEVEDO,450
1022,DEPUTADO FEDERAL,ANTONIO MARCOS PAPINHA DA SILVA,3241
1023,DEPUTADO FEDERAL,ANTONIO LUIZ DE OLIVEIRA,933
1026,DEPUTADO FEDERAL,MARCIA RAMOS GOMES,65
1027,DEPUTADO FEDERAL,ANDREA MARIA DE FARIA ANTUNES,1734
1030,DEPUTADO FEDERAL,IVAN DA PONTE RABELLO,831
1033,DEPUTADO FEDERAL,ROSANGELA DE SOUZA GOMES,76292
1038,DEPUTADO FEDERAL,NAYARA GILDA GOMES ACHA PRESTES,1419
1042,DEPUTADO FEDERAL,MARIA EMILIA DE OLIVEIRA FERNANDES VOSS,364
1043,DEPUTADO FEDERAL,CRISTIANE ANDRADE VIANA,1083
1044,DEPUTADO FEDERAL,MARTHA DOS SANTOS CARDOSO,2451
1045,DEPUTADO FEDERAL,MARCIO DE CARVALHO MACHADO,4671
1047,DEPUTADO FEDERAL,ANDREA LOURIÇAL FIRMO DE ARAUJO,923
1051,DEPUTADO FEDERAL,WILLIAM OLINDA SODRÉ,1190
1055,DEPUTADO FEDERAL,JULIO DA SILVA GONÇALVES OLIVEIRA,3306
1056,DEPUTADO FEDERAL,ELIMAR MÁXIMO DAMASCENO,1480
1057,DEPUTADO FEDERAL,PAULO CESAR ALVES DOS SANTOS,1412
1060,DEPUTADO FEDERAL,PAULO CESAR MARTINEZ Y ALONSO,636
1066,DEPUTADO FEDERAL,RICARDO MAGALHÃES GARCIA GUTIERREZ,8714
1068,DEPUTADO FEDERAL,CATIA MARIA FONSECA DA CRUZ,1388
1072,DEPUTADO FEDERAL,LUCIANA DIAS HENRIQUE DOS SANTOS,145
1074,DEPUTADO FEDERAL,SEBASTIÃO DA COSTA CANDIDO,1106
1077,DEPUTADO FEDERAL,ALBERTINO ALVES PEREIRA JUNIOR,53250
1078,DEPUTADO FEDERAL,ELIANE VIANA JORDAO FERNANDES,2497
1081,DEPUTADO FEDERAL,JOÃO CARLOS LUIZ VAZ MARQUES LEZIRIA,2070
1082,DEPUTADO FEDERAL,MARTEM SARMENTO MATOSO,558
1088,DEPUTADO FEDERAL,EDUARDO FERREIRA DE OLIVEIRA,17347
1091,DEPUTADO FEDERAL,BRUNO DA SILVA NASCIMENTO,2062
1099,DEPUTADO FEDERAL,LEONARDO BRASIL DO ROZARIO,1782
1100,DEPUTADO FEDERAL,MARCELO ANDRÉ CID HERÁCLITO DO PORTO QUEIROZ,73728
1101,DEPUTADO FEDERAL,ARTHUR PEDRO DA SILVA COSTA,1122
1104,DEPUTADO FEDERAL,LEANDRO DE SOUZA CAVALIERI VALLE,714
1108,DEPUTADO FEDERAL,ZILMARA BRANDAO DA SILVA,2104
1110,DEPUTADO FEDERAL,MÔNICA PAULA DOS SANTOS FERNANDES,724
1111,DEPUTADO FEDERAL,JULIO LUIZ BAPTISTA LOPES,50019
1112,DEPUTADO FEDERAL,JORGE LUIZ LIMA RANGEL,2985
1113,DEPUTADO FEDERAL,FRANCISCO CARLOS DE FARIAS,1474
1115,DEPUTADO FEDERAL,VALÉRIA BAILÃO MELO,516
1117,DEPUTADO FEDERAL,GLAUCIA MARIA BRENNY,1808
1118,DEPUTADO FEDERAL,ALEXANDRA OLIVEIRA MENEZES,3263
1120,DEPUTADO FEDERAL,PAULO HENRIQUE BRAZ DA COSTA,997
1121,DEPUTADO FEDERAL,ATAIDE FIGUEIRA CARNEIRO JUNIOR,3209
1122,DEPUTADO FEDERAL,FELICIO LATERÇA DE ALMEIDA,39581
1123,DEPUTADO FEDERAL,CINTIA ALVES SALGUEIRO SAVELLI,1794
1125,DEPUTADO FEDERAL,ROBERTO  DE SOUZA EMIDIO,8284
1127,DEPUTADO FEDERAL,LUIZ ANTONIO DA COSTA CARVALHO CORREA DA SILVA,43937
1131,DEPUTADO FEDERAL,JANE LOUISE RODRIGUES SOUZA,1083
1132,DEPUTADO FEDERAL,CLEBER ANTONIO DA SILVA,2874
1133,DEPUTADO FEDERAL,DANILO CASSANE SOARES,7953
1135,DEPUTADO FEDERAL,ANTONIO CARLOS DOS SANTOS RIBEIRO,331
1138,DEPUTADO FEDERAL,ANDRE LUIS SILVA DE MIRANDA,553
1140,DEPUTADO FEDERAL,CAROLINE MIDORI DA COSTA SILVA,10436
1143,DEPUTADO FEDERAL,LEANDRO FRANCISCO MACHADO NEVES,1210
1144,DEPUTADO FEDERAL,ELIZABETH PATRICIA LAGE,475
1145,DEPUTADO FEDERAL,JANIO COSENDEY NUNES,352
1147,DEPUTADO FEDERAL,RENEIDA DOS SANTOS DA SILVA,326
1150,DEPUTADO FEDERAL,ROBERTO SANT ANA BARROSO,1376
1151,DEPUTADO FEDERAL,DEYSON BAPTISTA THOMÉ,502
1153,DEPUTADO FEDERAL,ANDERSON MELLO VILELA,1075
1154,DEPUTADO FEDERAL,SERGIO RICARDO FERREIRA,483
1155,DEPUTADO FEDERAL,CHRISTINO AUREO DA SILVA,27300
1160,DEPUTADO FEDERAL,LUIZ FERNANDO DUARTE CORREA,667
1166,DEPUTADO FEDERAL,ELIANE DE CASTRO MORAES,2124
1168,DEPUTADO FEDERAL,ROSIMAR DA SILVA FERRAZ MEDEIROS,429
1169,DEPUTADO FEDERAL,CARLOS DARCY ALVES BERSOT,237
1172,DEPUTADO FEDERAL,JORGE SANTANA QUEIROZ,1153
1173,DEPUTADO FEDERAL,IRONILSON BARROS DINIZ,540
1176,DEPUTADO FEDERAL,IVÂNIA DAS GRAÇAS MARTINS,459
1177,DEPUTADO FEDERAL,LUIZ ANTONIO DE SOUZA TEIXEIRA JUNIOR,190071
1178,DEPUTADO FEDERAL,CARLA ANTUNES MARINS PEREIRA,127
1180,DEPUTADO FEDERAL,PEDRO AUGUSTO PALARETI,21790
1188,DEPUTADO FEDERAL,MARCELLO MORAES  SICILIANO,21104
1189,DEPUTADO FEDERAL,LOURIVAL GOMES DE ALMEIDA,27602
1193,DEPUTADO FEDERAL,ROBERTO ROBADEY COSTA JUNIOR,3022
1196,DEPUTADO FEDERAL,PATRICIA MACHADO ORSI,217
1199,DEPUTADO FEDERAL,HAROLDO VICTORIANO BUNN,2122
1200,DEPUTADO FEDERAL,ALENCAR DACIOLO FONSECA DOS SANTOS,6384
1201,DEPUTADO FEDERAL,ORLANDO ZACCONE DELIA FILHO,3123
1202,DEPUTADO FEDERAL,DAVI DOS SANTOS SOUZA,4655
1203,DEPUTADO FEDERAL,JOSE MANOEL DE LIMA,255
1205,DEPUTADO FEDERAL,HELIO AFONSO SILVA,3012
1208,DEPUTADO FEDERAL,SYLVIO ALEXANDRE GOUVEA,267
1210,DEPUTADO FEDERAL,FRANCISCO JOSE D ANGELO,22782
1211,DEPUTADO FEDERAL,ANDRE LUIZ MONICA E SILVA,13720
1212,DEPUTADO FEDERAL,DAVID MICHAEL DOS SANTOS MIRANDA,2700
1213,DEPUTADO FEDERAL,RAIMUNDO EMILIANO VIEIRA,1151
1214,DEPUTADO FEDERAL,CARLOS ALBERTO CUNHA CRUZ,706
1216,DEPUTADO FEDERAL,MARCOS PAULO BARBOSA TAVARES,62086
1217,DEPUTADO FEDERAL,ESLEY RODRIGUES DE JESUS TEIXEIRA,1032
1218,DEPUTADO FEDERAL,CARLOS JESUS ONTIVEROS GUARDIA,2380
1220,DEPUTADO FEDERAL,RIVERTON MUSSI RAMOS,10519
1221,DEPUTADO FEDERAL,ANICET OKINGA,1715
1222,DEPUTADO FEDERAL,MIRO TEIXEIRA,20805
1223,DEPUTADO FEDERAL,DALMAR LIRIO MAZINHO DE ALMEIDA FILHO,12587
1224,DEPUTADO FEDERAL,MARISTELA GAIO FIGUEIRA,233
1225,DEPUTADO FEDERAL,ANTONIO MARCOS RODRIGUES PIRES,1824
1226,DEPUTADO FEDERAL,SIMONE PEREIRA DA SILVA,728
1228,DEPUTADO FEDERAL,KATIA REGINA DA SILVA SANTOS,258
1232,DEPUTADO FEDERAL,ELIANE DE OLIVEIRA PIRES,561
1235,DEPUTADO FEDERAL,MOISES DA SILVA BOECHAT,1859
1236,DEPUTADO FEDERAL,LUIZ CARLOS ANDRADE DE SOUZA,2377
1239,DEPUTADO FEDERAL,MARIA HELENA VIEIRA MARTINS,149
1242,DEPUTADO FEDERAL,LORENA CRISTINE SILVA SANTOS,537
1244,DEPUTADO FEDERAL,WAGNER PAULO CORREA AVELLAR,809
1245,DEPUTADO FEDERAL,RENATO FERREIRA DE OLIVEIRA CARIELLO,19230
1250,DEPUTADO FEDERAL,CLAUDIO JOSE DE OLIVEIRA,1967
1251,DEPUTADO FEDERAL,ELAINE SANTOS DE OLIVEIRA,280
1255,DEPUTADO FEDERAL,WOLUSTON GOMES CELESTINO,8455
1256,DEPUTADO FEDERAL,JORGE ROSA DA SILVA,550
1258,DEPUTADO FEDERAL,ANDREA DE MELLO VIEIRA SIQUEIRA,1170
1263,DEPUTADO FEDERAL,ANA BEATRIZ BERNARDES NUNES,4226
1264,DEPUTADO FEDERAL,JOSE MARIA DA SILVA PESSANHA,43
1266,DEPUTADO FEDERAL,BRENO BARBOSA,125
1276,DEPUTADO FEDERAL,MACIEL LEMOS NASCIMENTO,235
1277,DEPUTADO FEDERAL,ROSILENE OLIMPIO DOS SANTOS,810
1282,DEPUTADO FEDERAL,DANIELLE ANDRADE FERNANDES,527
1283,DEPUTADO FEDERAL,LUIS CLAUDIO DE SANTANA,1928
1285,DEPUTADO FEDERAL,GLAUCIA BARBOSA CANDIDO ALVES SLANA,1039
1288,DEPUTADO FEDERAL,PATRICIA ANTUNES CARDOSO,759
1289,DEPUTADO FEDERAL,MARCIA HELENA BRAGA CAMARGO,214
1290,DEPUTADO FEDERAL,PAULO AFONSO CUNHA,553
1291,DEPUTADO FEDERAL,SUANECIR FRANCISCO,423
1292,DEPUTADO FEDERAL,CLAUDIO LUIZ PINTO,321
1299,DEPUTADO FEDERAL,GABRIEL PENIN GARCIA,1163
1300,DEPUTADO FEDERAL,LUIZ LINDBERGH FARIAS FILHO,152219
1301,DEPUTADO FEDERAL,DIMAS DE PAIVA GADELHA JUNIOR,41238
1302,DEPUTADO FEDERAL,WELLINGTON MOREIRA DA SILVA,2812
1303,DEPUTADO FEDERAL,WESLEY DINIZ FURTADO,2810
1305,DEPUTADO FEDERAL,EMÍLIA RACHEL BENDELAK AMOÊDO,581
1307,DEPUTADO FEDERAL,MAIARA FELÍCIO DA SILVA,14481
1310,DEPUTADO FEDERAL,RICARDO LODI RIBEIRO,31490
1311,DEPUTADO FEDERAL,ROGÉRIO LÚCIO MARQUES DA COSTA,897
1312,DEPUTADO FEDERAL,LEONEL BRIZOLA,7989
1313,DEPUTADO FEDERAL,WASHINGTON LUIZ CARDOSO SIQUEIRA,113282
1315,DEPUTADO FEDERAL,JOSE ANTONIO DA SILVA,334
1317,DEPUTADO FEDERAL,FRANCELINO DA SILVA PAES,467
1320,DEPUTADO FEDERAL,LETICIA PIRES DE OLIVEIRA,1382
1321,DEPUTADO FEDERAL,VALDOMARK BATISTA TAVARES,864
1322,DEPUTADO FEDERAL,WADIH NEMER DAMOUS FILHO,27833
1323,DEPUTADO FEDERAL,MARGOTH SILVANA DA SILVA CARDOSO,1061
1329,DEPUTADO FEDERAL,CAMILA APARECIDA MARINS ALVARENGA THEODORO,4628
1330,DEPUTADO FEDERAL,IONE EFIGENIA DOS SANTOS,1133
1331,DEPUTADO FEDERAL,GABRIELA CORREIA DE SOUZA E LIMA,3581
1333,DEPUTADO FEDERAL,REIMONT LUIZ OTONI SANTA BÁRBARA,39325
1340,DEPUTADO FEDERAL,SANDRO ALEX DE OLIVEIRA CEZAR,7324
1344,DEPUTADO FEDERAL,ANTONIO PEREIRA DA SILVA LOBÃO FILHO,3633
1350,DEPUTADO FEDERAL,JOSÉ MARIA FERREIRA RANGEL,25589
1355,DEPUTADO FEDERAL,LUCIANA GONÇALVES DE NOVAES,31052
1357,DEPUTADO FEDERAL,PAULO VITOR XAVIER SANTOS,399
1360,DEPUTADO FEDERAL,RODRIGO MIGUEL GOMES FERREIRA,824
1366,DEPUTADO FEDERAL,FRANC JEFERSON ALARCON DE BARRIENTOS,2751
1367,DEPUTADO FEDERAL,MARIA DAS GRAÇAS GOMES FRANCO,1007
1368,DEPUTADO FEDERAL,DENILSON DE SOUZA,353
1369,DEPUTADO FEDERAL,INDIANARAE PEREIRA SIQUEIRA,4962
1370,DEPUTADO FEDERAL,MARIA LUCIA COSTA SILVA,774
1377,DEPUTADO FEDERAL,BENEDITA SOUZA DA SILVA SAMPAIO,113831
1388,DEPUTADO FEDERAL,ROBSON SOUZA SANTOS,460
1391,DEPUTADO FEDERAL,NARA CRISTINA PEREIRA DA SILVA,373
1394,DEPUTADO FEDERAL,CLAUDIMAR LOURENÇO DA ROCHA,550
1399,DEPUTADO FEDERAL,VIRGILIO DE OLIVEIRA SOUZA,978
1400,DEPUTADO FEDERAL,ROSANGELA PEÇANHA DA SILVA BRITO DOS SANTOS,1342
1401,DEPUTADO FEDERAL,REGINA CÉLIA DE SOUZA BENTO SEQUEIRA,242
1402,DEPUTADO FEDERAL,DANIEL DA SILVA MOFACTO,2754
1404,DEPUTADO FEDERAL,VALERIA CRISTINA ANTUNES THOME  FERREIRA,620
1405,DEPUTADO FEDERAL,ANA PAULA GOLDBACH,247
1406,DEPUTADO FEDERAL,CAROLINE ARIEL KIMBERLY MARTINS LEITE,754
1407,DEPUTADO FEDERAL,CASSIO VINICIUS LOPES PORTES,2032
1410,DEPUTADO FEDERAL,PAULO SERGIO CORREIA DE QUEIROZ,604
1411,DEPUTADO FEDERAL,ALESSANDRE ALEX PEREIRA DOMINGUES,1090
1412,DEPUTADO FEDERAL,ROBERTO LUCIO CERDEIRA,1692
1413,DEPUTADO FEDERAL,AUGUSTO ANTONIO DOS SANTOS,1505
1414,DEPUTADO FEDERAL,LILIAM SÁ DE PAULA,1455
1415,DEPUTADO FEDERAL,RITA DE CASSIA SILVA DA ROSA DOS SANTOS,165
1416,DEPUTADO FEDERAL,RENATO CORREA CAMPELLO,289
1417,DEPUTADO FEDERAL,RAQUEL MACIEL DA SILVA,1210
1420,DEPUTADO FEDERAL,ANA PAULA DA SILVA ANDRADE,447
1422,DEPUTADO FEDERAL,SERGIO RICARDO LOPES DE SOUZA,22148
1423,DEPUTADO FEDERAL,MANOEL MARINHO DE SOUZA,341
1426,DEPUTADO FEDERAL,DENILSON ALVES PASSOS,116
1427,DEPUTADO FEDERAL,AURORA DA SILVA RIBEIRO,385
1430,DEPUTADO FEDERAL,SAMUEL SIQUEIRA DA SILVA,390
1431,DEPUTADO FEDERAL,SILVIO LUIZ FERNANDES DE CASTRO,1923
1433,DEPUTADO FEDERAL,CARLOS ROBERTO RODRIGUES,41075
1434,DEPUTADO FEDERAL,JOÃO ROBERTO AVILA GOULART,84
1435,DEPUTADO FEDERAL,JÔNATHAS DA ROCHA AMÂNCIO,269
1440,DEPUTADO FEDERAL,RENATA MONTEIRO HENRIQUE,189
1441,DEPUTADO FEDERAL,PAOLA DA SILVA DANIEL,25629
1444,DEPUTADO FEDERAL,JOYCE ALBUQUERQUE DA ROCHA LEITE,2580
1445,DEPUTADO FEDERAL,FLAVIO PACCA CASTELLO BRANCO,4788
1450,DEPUTADO FEDERAL,ANTÔNIO LUIZ MASCIA BARRETO,68
1451,DEPUTADO FEDERAL,GLAUCIO MARCELO FONSECA DA SILVA,1789
1454,DEPUTADO FEDERAL,BENEDITO MENDES BRANDÃO,112
1455,DEPUTADO FEDERAL,CARLOS CORREIA JUNIOR,589
1461,DEPUTADO FEDERAL,EDNARDO DAVILA MELLO RAPOSO,13573
1465,DEPUTADO FEDERAL,ROSELENE MARTINS CARNEIRO LEITE,153
1466,DEPUTADO FEDERAL,LEONARDO FURTADO MAGALHAES,1448
1467,DEPUTADO FEDERAL,CHARLES MAURÍCIO DA SILVA,407
1470,DEPUTADO FEDERAL,LUCAS HENRIQUE FEITOSA DE MATTOS,3331
1474,DEPUTADO FEDERAL,ELIAS MIGUEL,665
1475,DEPUTADO FEDERAL,AROLDO DE SOUZA NASCIMENTO,120
1476,DEPUTADO FEDERAL,PEDRO RIBEIRO FERREIRA,227
1477,DEPUTADO FEDERAL,JOEL BITENCOURT SERRA,2393
1478,DEPUTADO FEDERAL,PETER SALOMÃO BUARQUE DO ESPÍRITO SANTO,705
1484,DEPUTADO FEDERAL,MARCUS VINICIUS DE VASCONCELOS FERREIRA,24219
1488,DEPUTADO FEDERAL,JORGE LUIS DE ALMEIDA JUNIOR,681
1490,DEPUTADO FEDERAL,ADALBERTO DE SOUZA RABELO,2300
1492,DEPUTADO FEDERAL,JULLIENE CABRAL SALVIANO DA SILVA,707
1500,DEPUTADO FEDERAL,JOÃO LUIS DUTRA LEITE,2330
1501,DEPUTADO FEDERAL,MARCO ANTONIO NEVES CABRAL,23806
1502,DEPUTADO FEDERAL,MARCOS HENRIQUE ALVES PIMENTEL,3916
1503,DEPUTADO FEDERAL,BARBARA SOLANGE ROSA DOS SANTOS,258
1505,DEPUTADO FEDERAL,ANGELICA ROMÃO MARCELINO,755
1507,DEPUTADO FEDERAL,RAQUEL RAMOS RODRIGUES CUNHA,373
1509,DEPUTADO FEDERAL,GILCÉIA MACHADO DE SOUZA,163
1511,DEPUTADO FEDERAL,DEULER DA ROCHA GONÇALVES JUNIOR,1078
1512,DEPUTADO FEDERAL,ADENIR DE PAULA BRETAS JUNIOR,1227
1514,DEPUTADO FEDERAL,SELMA BARRETO DA CRUZ,101
1515,DEPUTADO FEDERAL,TARCISIO DE MIRANDA ASSED ESTEFAN,8736
1516,DEPUTADO FEDERAL,GUTEMBERG REIS DE OLIVEIRA,133612
1517,DEPUTADO FEDERAL,NIELSON RODRIGO VICENTE DOS ANJOS,1860
1520,DEPUTADO FEDERAL,GILBERTO SALARINI,884
1522,DEPUTADO FEDERAL,OTONI MOURA DE PAULO JUNIOR,158507
1523,DEPUTADO FEDERAL,GABRIELA BARBOZA MARQUES,2585
1525,DEPUTADO FEDERAL,ELBA MARIA BARCELLOS BASTOS,204
1526,DEPUTADO FEDERAL,LEANDRO BARBOSA DE SOUZA,614
1527,DEPUTADO FEDERAL,BARBARA CRISTINA BERNARDES FERREIRA,153
1530,DEPUTADO FEDERAL,SONIA MARIA FERNANDES SOARES,984
1533,DEPUTADO FEDERAL,ANDRÉ SANTIAGO DA COSTA,1046
1534,DEPUTADO FEDERAL,MARCOS DO ESPIRITO SANTO DA SILVA,400
1540,DEPUTADO FEDERAL,PAULO CESAR DOMICIANO,1124
1544,DEPUTADO FEDERAL,ALDILAS HUNGRIA TOLEDO,2682
1545,DEPUTADO FEDERAL,GILBERTO DANIEL DE CARVALHO,557
1550,DEPUTADO FEDERAL,MAX MILLER AUGUSTO DE OLIVEIRA,1412
1551,DEPUTADO FEDERAL,ANDRÉ DOS SANTOS FIUZA,596
1554,DEPUTADO FEDERAL,MATHEUS PEREIRA GONÇALVES,193
1555,DEPUTADO FEDERAL,GABRIELLA SILVA THINNES,1022
1561,DEPUTADO FEDERAL,MARCELO DE ALENCAR FERREIRA,2957
1562,DEPUTADO FEDERAL,MARLUCIA DE SOUZA RAPHAEL,258
1563,DEPUTADO FEDERAL,MISAEL CICERO DA SILVA,417
1566,DEPUTADO FEDERAL,ROGERIO DE OLIVEIRA ROSA,656
1567,DEPUTADO FEDERAL,ANA CLAUDIA DE AZEREDO  MELLO,1062
1569,DEPUTADO FEDERAL,JORGE VIEIRA DE ABREU,473
1570,DEPUTADO FEDERAL,FELIPE MACEDO BRASILEIRO,8251
1572,DEPUTADO FEDERAL,LUCIANA ALVES DE MACEDO PEREIRA,672
1573,DEPUTADO FEDERAL,MARIA JOSE ALVES MACHADO,67
1574,DEPUTADO FEDERAL,HELEN DE PAULA BARRETO,122
1577,DEPUTADO FEDERAL,RENATO ROSA XAVIER,684
1578,DEPUTADO FEDERAL,LEONARDO DA SILVA LEAL,350
1580,DEPUTADO FEDERAL,LEONARDO CARNEIRO MONTEIRO PICCIANI,37125
1588,DEPUTADO FEDERAL,CARLOS ALBERTO DE SANT ANNA,1646
1593,DEPUTADO FEDERAL,FRANCISCO CARLOS CORTES ALVES,1669
1598,DEPUTADO FEDERAL,ROGERIO AMORIM DA SILVA,341
1599,DEPUTADO FEDERAL,GLAUBER JOAQUIM DE MATOS CORREA,571
1600,DEPUTADO FEDERAL,VÂNIA MARIA BORGES DA LUZ,303
1616,DEPUTADO FEDERAL,VINÍCIUS CAMARGO PEREIRA DA COSTA,621
1818,DEPUTADO FEDERAL,HELOÍSA HELENA LIMA DE MORAES CARVALHO,38161
1877,DEPUTADO FEDERAL,FABRÍCIO LÍRIO RODRIGUES,481
1888,DEPUTADO FEDERAL,AUGUSTO MENDES E SILVA DE ALMEIDA,274
1900,DEPUTADO FEDERAL,ALEXANDRE TEIXEIRA DE FREITAS RODRIGUES,10668
1901,DEPUTADO FEDERAL,JORGE LUIZ MATOS DE OLIVEIRA,1652
1902,DEPUTADO FEDERAL,WAGNER PIRES COELHO,4520
1903,DEPUTADO FEDERAL,ALONSIMAR DE OLIVEIRA PESSANHA,9811
1905,DEPUTADO FEDERAL,ELIZANGELA VIEIRA DA SILVA LOBO,2310
1907,DEPUTADO FEDERAL,MONICA SA DO NASCIMENTO PEREIRA DA COSTA,410
1908,DEPUTADO FEDERAL,SIDNEIA APARECIDA LIMA,142
1909,DEPUTADO FEDERAL,LEONARDO DOS SANTOS,3192
1910,DEPUTADO FEDERAL,JEFFERSON VIDAL PINHEIRO,15190
1911,DEPUTADO FEDERAL,JOSE PORTUGAL NETO,33368
1912,DEPUTADO FEDERAL,CARLOS ALBERTO SIQUEIRA DA SILVA,24224
1913,DEPUTADO FEDERAL,JOSE ANTONIO DE SOUZA BATISTA,898
1914,DEPUTADO FEDERAL,ANDRE LUIS DA SILVA CAMPISTA,1048
1915,DEPUTADO FEDERAL,WAGNER CARVALHO DE SENA,461
1918,DEPUTADO FEDERAL,ADRIANO DE ALMEIDA SILVA,1489
1919,DEPUTADO FEDERAL,MARCUS VENISSIUS DA SILVA BARBOSA,31140
1920,DEPUTADO FEDERAL,CLEBER RIBEIRO AFONSO,2597
1921,DEPUTADO FEDERAL,MARIA DE FATIMA ALVES GONÇALVES,63
1922,DEPUTADO FEDERAL,LEONARDO RODRIGUES,17154
1923,DEPUTADO FEDERAL,JEAN PIERRE PEREIRA SALLES,1890
1926,DEPUTADO FEDERAL,ANTONIA FACILDA MARTINS RODRIGUES,58
1928,DEPUTADO FEDERAL,GILBERTO MESSIAS DO NASCIMENTO,1053
1929,DEPUTADO FEDERAL,PAULO SANTOS MESSINA,15416
1930,DEPUTADO FEDERAL,PAULO RODRIGUES ALVES DA SILVA,1485
1933,DEPUTADO FEDERAL,CARLOS HENRIQUE RIOS LEMOS,10364
1935,DEPUTADO FEDERAL,SOLANGE ROSA DE SOUZA,245
1937,DEPUTADO FEDERAL,MANOEL ALEXANDRE PEREIRA DE FIGUEIREDO,7335
1939,DEPUTADO FEDERAL,QUÉREM HAPUQUE TEIXEIRA DA ROCHA,380
1940,DEPUTADO FEDERAL,THIAGO DE SANT ANNA CABRAL,2665
1944,DEPUTADO FEDERAL,RENATO CORDEIRO JUNIOR,5975
1945,DEPUTADO FEDERAL,IGOR PORTO GAVAZZI,17312
1946,DEPUTADO FEDERAL,GABRIELA MORAIS DA SILVA SANTOS,106
1950,DEPUTADO FEDERAL,JOSE APRIGIO DA SILVA,2039
1953,DEPUTADO FEDERAL,ANGELA MARIA TENORIO DE ALBUQUERQUE,1178
1955,DEPUTADO FEDERAL,WILSON ALEXANDRINO BARCELLOS DE SOUZA,1396
1956,DEPUTADO FEDERAL,ADEMIR ALVES DE MELO,7825
1966,DEPUTADO FEDERAL,FERNANDO DA SILVA FERNANDES,1575
1977,DEPUTADO FEDERAL,RUBENS TEIXEIRA DA SILVA,2376
1980,DEPUTADO FEDERAL,BRUNO LOPES DE ALMEIDA,898
1985,DEPUTADO FEDERAL,LEIDEMEIRE ROCHA BARRETO DA SILVA,203
1988,DEPUTADO FEDERAL,PAULA NEVES MAGALHAES DE BARROS,3388
1989,DEPUTADO FEDERAL,KENIA DE SOUZA GONCALVES DOS SANTOS,160
1990,DEPUTADO FEDERAL,ALESSANDRA CRISTINA MAGALHAES SANTOS,318
1991,DEPUTADO FEDERAL,VANDETE MARIA SOARES,274
1993,DEPUTADO FEDERAL,PRISCILA CAVALCANTI DE ARAUJO,85
1998,DEPUTADO FEDERAL,LEANDRO NASCIMENTO FARIAS,1473
1999,DEPUTADO FEDERAL,LINCOLN DONATO NUNES,17187
2000,DEPUTADO FEDERAL,GABRIELLY DAMASCENO DA SILVA,1697
2001,DEPUTADO FEDERAL,CRISTIANO LINDEMBERG MOREIRA DE MORAGAS,1920
2002,DEPUTADO FEDERAL,CAIO MARCELO DE ARAUJO LOPES,1336
2005,DEPUTADO FEDERAL,GISELE SILVA DOS SANTOS BATISTA,479
2006,DEPUTADO FEDERAL,RENATO MOURA MONTES,163
2007,DEPUTADO FEDERAL,CARLOS JOSE DE SANTANA,139
2008,DEPUTADO FEDERAL,MICHELLE CARDOSO ZACARIAS,274
2010,DEPUTADO FEDERAL,MARCIO GARCIA LINARES,6313
2012,DEPUTADO FEDERAL,JOAO MAURICIO FERREIRA GONÇALVES,2294
2013,DEPUTADO FEDERAL,GUILHERME SILVA DE OLIVEIRA,296
2016,DEPUTADO FEDERAL,AMANDA PADILHA DA SILVA,518
2017,DEPUTADO FEDERAL,THAIDYMILLA ROBERTA DE AZEVEDO PONTES,301
2018,DEPUTADO FEDERAL,NIVEA DE FATIMA LUIZ,128
2020,DEPUTADO FEDERAL,JONATAS RIBEIRO CASTELO BRANCO,4501
2022,DEPUTADO FEDERAL,EVERALDO DIAS PEREIRA,9522
2023,DEPUTADO FEDERAL,CARLOS HENRIQUE DE ANDRADE ADAO,261
2025,DEPUTADO FEDERAL,JAQUELINE LOPES DE ARAUJO,110
2030,DEPUTADO FEDERAL,MAURO DOS SANTOS SILVA,453
2033,DEPUTADO FEDERAL,CARLOS ZALBERTO BOA MORTE FILHO,1700
2035,DEPUTADO FEDERAL,BEATRIZ DOS SANTOS NASCIMENTO,191
2040,DEPUTADO FEDERAL,MARCIO ALEXANDRO DE SOUZA,1891
2044,DEPUTADO FEDERAL,ANTONIO COSTA DE BRITO,108
2047,DEPUTADO FEDERAL,SILVIO DA COSTA SANTANA,1084
2050,DEPUTADO FEDERAL,LUIZ CARLOS DAS NEVES,383
2052,DEPUTADO FEDERAL,MONICA FRAGA DOS SANTOS DIB DA COSTA,373
2056,DEPUTADO FEDERAL,ANDERSON SILVA DA COSTA,386
2060,DEPUTADO FEDERAL,RONILDO FERREIRA SANTOS,48
2077,DEPUTADO FEDERAL,WELINGTON CARLOS DE AGUIAR,190
2100,DEPUTADO FEDERAL,MARIANA LIMA NOGUEIRA,2878
2121,DEPUTADO FEDERAL,GUSTAVO GALVÃO PEDRO,1360
2123,DEPUTADO FEDERAL,GABRIEL RODRIGUES DAUMAS MARQUES,1018
2200,DEPUTADO FEDERAL,LETÍCIA ALVES PEREIRA ENTRAGO,24520
2201,DEPUTADO FEDERAL,MAX GUILHERME MACHADO DE  MOURA,9489
2202,DEPUTADO FEDERAL,VERONICA CHAVES DE CARVALHO COSTA,31103
2206,DEPUTADO FEDERAL,WALDIR LUIZ FERRAZ,1967
2207,DEPUTADO FEDERAL,MARCUS WELBER GOMES DA SILVA,9718
2209,DEPUTADO FEDERAL,MAURO ALVES SOUZA,383
2210,DEPUTADO FEDERAL,FABIANA SILVA DE SOUZA,30096
2211,DEPUTADO FEDERAL,CARLOS ROBERTO COELHO DE MATTOS JUNIOR,114587
2212,DEPUTADO FEDERAL,EDUARDO PAZUELLO,205324
2213,DEPUTADO FEDERAL,MARCOS TEIXEIRA BRAZ,38623
2214,DEPUTADO FEDERAL,CHRISTINE NOGUEIRA DOS REIS TONIETTO,52583
2215,DEPUTADO FEDERAL,PRISCILA KARLA PEREIRA DOS SANTOS,1277
2217,DEPUTADO FEDERAL,ALEXANDRE RAMAGEM RODRIGUES,59170
2220,DEPUTADO FEDERAL,HELIO FERNANDO BARBOSA LOPES,132986
2221,DEPUTADO FEDERAL,ROSANE FELIX DO NASCIMENTO MALTA,38579
2222,DEPUTADO FEDERAL,SORAYA ALENCAR DOS SANTOS,130379
2223,DEPUTADO FEDERAL,RENATO COSTA DE OLIVEIRA,18899
2224,DEPUTADO FEDERAL,EDIMILSON RAMOS MIGOWSKI DE CARVALHO,9927
2225,DEPUTADO FEDERAL,AROLDO ANTONIO DE OLIVEIRA MENDONÇA,3878
2226,DEPUTADO FEDERAL,EDIANNE PAULO DE ABREU,2176
2227,DEPUTADO FEDERAL,ALLAN TURNOWSKI,18627
2230,DEPUTADO FEDERAL,FERNANDO DA SILVA VELOSO,5685
2232,DEPUTADO FEDERAL,RICARDO DE SOUZA COSTA,28353
2233,DEPUTADO FEDERAL,LUIZ EDUARDO CARNEIRO DA SILVA DE SOUZA LIMA,69088
2234,DEPUTADO FEDERAL,MARCELLO CAPPARELLI MONIZ DE ARAGÃO DÁQUER,3274
2235,DEPUTADO FEDERAL,ELAINE MOURA,648
2238,DEPUTADO FEDERAL,JOÃO CARLOS SOARES GURGEL,11531
2244,DEPUTADO FEDERAL,HERMITON BATISTA MOURA,7716
2245,DEPUTADO FEDERAL,FLAVIO CAMPOS FERREIRA,46636
2250,DEPUTADO FEDERAL,PEDRO JOSÉ MANSO,2488
2252,DEPUTADO FEDERAL,MARCIO DA SILVEIRA LABRE,2501
2254,DEPUTADO FEDERAL,JULIO CEZAR KFURI,323
2255,DEPUTADO FEDERAL,GUTEMBERG DE PAULA FONSECA,19288
2256,DEPUTADO FEDERAL,LUCIANO VIEIRA MENDES,84942
2264,DEPUTADO FEDERAL,CHRISTIANNE DUARTE GAROIU,3842
2267,DEPUTADO FEDERAL,BIANCA DE CAMPOS CRUZ MACHADO,743
2269,DEPUTADO FEDERAL,ALTINEU CORTES FREITAS COUTINHO,167512
2270,DEPUTADO FEDERAL,MARINARA PEREIRA DA COSTA,6583
2274,DEPUTADO FEDERAL,ELIZABETH LILIAN FERRAZ VITORINO,146
2275,DEPUTADO FEDERAL,JEANE DE SOUZA DAMES,219
2277,DEPUTADO FEDERAL,SÓSTENES SILVA CAVALCANTE,65443
2278,DEPUTADO FEDERAL,RENAN MARASSI MAGALHÃES,26021
2282,DEPUTADO FEDERAL,ROBERTO LUIZ RODRIGUES DE OLIVEIRA,94221
2287,DEPUTADO FEDERAL,MILENA CARDOSO MOREIRA,298
2288,DEPUTADO FEDERAL,GELSON DE AZEVEDO ALMEIDA,4330
2299,DEPUTADO FEDERAL,CHARLLES BATISTA DA SILVA,41346
2300,DEPUTADO FEDERAL,RICARDO PEDREIRA RANGEL,4475
2301,DEPUTADO FEDERAL,WELLINGTON BRUNO SANTOS,1299
2303,DEPUTADO FEDERAL,PAULO FERNANDO VILLELA CANTUARIA,471
2304,DEPUTADO FEDERAL,NILTON WILSON SALOMÃO,16162
2310,DEPUTADO FEDERAL,MARCUS VINICIUS LOPES MARTINS,1661
2311,DEPUTADO FEDERAL,EDUARDO PAIVA DA SILVA,1492
2312,DEPUTADO FEDERAL,EDSON SANTOS SILVA,1108
2313,DEPUTADO FEDERAL,RENATA SILVEIRA DA COSTA,1664
2320,DEPUTADO FEDERAL,FLÁVIO DOS SANTOS ANTUNES,26461
2322,DEPUTADO FEDERAL,AUGUSTO CÉSAR SILVA SORAGE,5144
2323,DEPUTADO FEDERAL,ANTONIA MINDLIN LEITE BARBOSA,5617
2332,DEPUTADO FEDERAL,AGUINALDO MARTINS DOS SANTOS,377
2333,DEPUTADO FEDERAL,MANOEL TEIXEIRA DE MESQUITA NETO,613
2334,DEPUTADO FEDERAL,DANIELLE LIMA SANTANA,140
2344,DEPUTADO FEDERAL,SELMA MARIA RODRIGUES DA SILVA,506
2345,DEPUTADO FEDERAL,KATIA CRISTINA MIKI DA SILVA,5139
2350,DEPUTADO FEDERAL,CARLOS HENRIQUE DA SILVA BAÍA,106
2351,DEPUTADO FEDERAL,EMANUEL MARQUES CORRÊA,268
2356,DEPUTADO FEDERAL,ANDRE LUIZ COSTA DE SOUZA,1145
2360,DEPUTADO FEDERAL,FABIANO GONÇALVES,10339
2370,DEPUTADO FEDERAL,MAGALI FARIAS DA SILVEIRA NUNES SOUZA,126
2398,DEPUTADO FEDERAL,CLEIDE SOUZA FREIRE VICTORIO,802
2700,DEPUTADO FEDERAL,LUCIANA NERI DA SILVA,371
2707,DEPUTADO FEDERAL,ALEMAR GOIS SERRA,222
2708,DEPUTADO FEDERAL,DIVA MARIA DIAS VALENTINI ROZENDO,118
2710,DEPUTADO FEDERAL,GLAIDSON ACÁCIO DOS SANTOS,37935
2711,DEPUTADO FEDERAL,GILVANIO OLIVEIRA DA SILVA,650
2712,DEPUTADO FEDERAL,JORGE MURILO RODRIGUES DE MORAES,759
2714,DEPUTADO FEDERAL,MARCOS RODRIGUES DA SILVA,713
2715,DEPUTADO FEDERAL,CHEILA MOREIRA MACHADO ALVES,68
2716,DEPUTADO FEDERAL,MARIA JOSÉ RIBEIRO,69
2717,DEPUTADO FEDERAL,ROSILENE PADILHA DOS SANTOS DO NASCIMENTO,158
2719,DEPUTADO FEDERAL,ISMAEL CARLOS NASCIMENTO DE JESUS,825
2720,DEPUTADO FEDERAL,DELANEY MACHADO DA CUNHA,435
2722,DEPUTADO FEDERAL,REINALDO DE ALMEIDA,837
2723,DEPUTADO FEDERAL,MARCIA HELENA RIBEIRO DE AZEVEDO,78
2725,DEPUTADO FEDERAL,CELSO CAETANO DE MIRANDA,407
2727,DEPUTADO FEDERAL,SANDRO CARLO ALVES,367
2728,DEPUTADO FEDERAL,ELIEL DE SOUZA DO ROSÁRIO,425
2730,DEPUTADO FEDERAL,ANDERSON FRANCISCO PERCILIANO AMORIM,214
2731,DEPUTADO FEDERAL,JURANDIR JACINTHO DE SOUZA,373
2732,DEPUTADO FEDERAL,LUIS ANTONIO PEREIRA DA SILVA,584
2736,DEPUTADO FEDERAL,CARLOS ESEQUIEL SILVA DOS SANTOS,1177
2739,DEPUTADO FEDERAL,SONIA FELIX DA CRUZ DE JESUS MELO,187
2742,DEPUTADO FEDERAL,MÁRCIO VILARÓ SOUTO,617
2747,DEPUTADO FEDERAL,FABIO ROBERTO ARAÚJO ROMOLI,897
2751,DEPUTADO FEDERAL,LUIS CLAUDIO RIBEIRO DE ARAUJO,371
2752,DEPUTADO FEDERAL,ANTONIO ARLINDO DO NASCIMENTO,429
2755,DEPUTADO FEDERAL,CLAUDIO NASCIMENTO,1395
