NR_VOTAVEL,DS_CARGO,NM_VOTAVEL,QT_VOTOS
2756,DEPUTADO FEDERAL,JOSIANE SILVESTRE,102
2757,DEPUTADO FEDERAL,ALEXANDRE PAES QUIRINO,438
2758,DEPUTADO FEDERAL,CLAUDIO FELIPE DE SÁ,35
2759,DEPUTADO FEDERAL,SIMONE SILVA DE CARVALHO AZEREDO,1
2761,DEPUTADO FEDERAL,SILAS SILVA DE OLIVEIRA,62
2762,DEPUTADO FEDERAL,MARCUS DE FREITAS TAVARES,789
2763,DEPUTADO FEDERAL,RAIZA MARINS DE OLIVEIRA,24
2765,DEPUTADO FEDERAL,ANA KATIUSCIA DA SILVA OLIVEIRA,120
2773,DEPUTADO FEDERAL,MARCIO MONTENEGRO TESCH,11
2774,DEPUTADO FEDERAL,COSME DA SILVEIRA LOURENÇO,108
2777,DEPUTADO FEDERAL,JOSÉ JALMIR DE MEDEIROS,758
2782,DEPUTADO FEDERAL,JEAN CARLOS FREITAS,358
2785,DEPUTADO FEDERAL,FILIPE MENDES SANTOS,86
2788,DEPUTADO FEDERAL,THAYNÁ CHRISTINE DOS SANTOS GOULART,132
2791,DEPUTADO FEDERAL,RONALD DE LIMA MIRANDA,89
2792,DEPUTADO FEDERAL,JORGINA SOUZA DA CONCEIÇÃO,11
2797,DEPUTADO FEDERAL,MARCELO DE SOUZA,1350
2799,DEPUTADO FEDERAL,MARIA LUIZA PEREIRA RODRIGUES GOMES,151
2800,DEPUTADO FEDERAL,FLAVIA DE OLIVEIRA FREITAS,1024
2801,DEPUTADO FEDERAL,HELIMAR DE AZEVEDO,185
2802,DEPUTADO FEDERAL,HENYS PINTO DA SILVA,1265
2803,DEPUTADO FEDERAL,ZULEIDE DA SILVA RAMOS,263
2804,DEPUTADO FEDERAL,DÉBORA CLAUDIA SANTOS MONTEIRO,133
2805,DEPUTADO FEDERAL,ALINE DO NASCIMENTO VIANA,1338
2809,DEPUTADO FEDERAL,DANIELLE DA SILVA PASSOS CARVALHO,284
2811,DEPUTADO FEDERAL,ROBERTO LINHARES DA SILVA,21
2812,DEPUTADO FEDERAL,LENILSON TEIXEIRA FAZOLO,1649
2816,DEPUTADO FEDERAL,LAERCIO DO CARMO,143
2817,DEPUTADO FEDERAL,JOSE DE RIBAMAR CUTRIM GOMES,285
2818,DEPUTADO FEDERAL,MARIA DO CARMO SANTOS FERREIRA DE MELLO,170
2821,DEPUTADO FEDERAL,LETICIA GABRIEL CABRAL DE BARROS,64
2822,DEPUTADO FEDERAL,ALEXANDRE DA SILVA PIMENTEL,1518
2823,DEPUTADO FEDERAL,MARCELO BOSCHER NUNES,1437
2824,DEPUTADO FEDERAL,ALEXANDRE CARVALHO DA SILVA,874
2825,DEPUTADO FEDERAL,MARIA DO CARMO SILVA,154
2826,DEPUTADO FEDERAL,BEATRIZ PEREIRA CORBETA,68
2827,DEPUTADO FEDERAL,GLORIA DE OLIVEIRA,376
2828,DEPUTADO FEDERAL,GUSTAVO MODESTO SCHMIDT,4588
2829,DEPUTADO FEDERAL,FLÁVIO CAUTIERO HORTA JARDIM,2344
2832,DEPUTADO FEDERAL,TAÍS DE ALMEIDA OLIVEIRA,21
2833,DEPUTADO FEDERAL,FRANKLIN JOSÉ DA MOTA,282
2834,DEPUTADO FEDERAL,JORGE DA SILVA COSTA,202
2844,DEPUTADO FEDERAL,ELISÂNGELA DE FREITAS,37
2846,DEPUTADO FEDERAL,GASPAR HERBERT STEIN,82
2850,DEPUTADO FEDERAL,ANDRÉ RICARDO DOS SANTOS AFFONSO,241
2853,DEPUTADO FEDERAL,JOSÉ MAIA MENDES DA SILVA FILHO,74
2854,DEPUTADO FEDERAL,RAFAELA OLIVEIRA DE MELO,71
2855,DEPUTADO FEDERAL,ANTÔNIO FERNANDES ANTUNES,4565
2858,DEPUTADO FEDERAL,MAURO CESAR MACEDO DO NASCIMENTO,853
2860,DEPUTADO FEDERAL,DARIO JOSE DA SILVA FERREIRA,253
2864,DEPUTADO FEDERAL,ANDREA PAOLA COSTA PRADO,100
2866,DEPUTADO FEDERAL,SARITA ALVES FERREIRA PAIVA,840
2869,DEPUTADO FEDERAL,NELSON ALVES FERREIRA NETTO,556
2873,DEPUTADO FEDERAL,EDUARDO PACHECO TERRA,3692
2876,DEPUTADO FEDERAL,FÁBIO ALVES GARRIDO,508
2877,DEPUTADO FEDERAL,DENIS DE PAULA FERREIRA,1915
2880,DEPUTADO FEDERAL,LEANDRO DOS SANTOS COSTA,463
2882,DEPUTADO FEDERAL,REGIS AYRTON LERMEN,1044
2883,DEPUTADO FEDERAL,ANDERSON LUIS DE AZEVEDO BARRETO,520
2888,DEPUTADO FEDERAL,DANIEL FERNANDES DE OLIVEIRA,597
2899,DEPUTADO FEDERAL,RICARDO GOMES ARANHA,247
2929,DEPUTADO FEDERAL,HENRIQUE VITAL BRAZIL SIMONARD,219
2939,DEPUTADO FEDERAL,ROMULO REIS CALABRIA SODRE,50
2949,DEPUTADO FEDERAL,CAETANO ALBUQUERQUE SIGILIANO,24
2959,DEPUTADO FEDERAL,BEATRIZ MENDES DE MELO,92
2979,DEPUTADO FEDERAL,RYAN ALBUQUERQUE DA SILVA,35
2989,DEPUTADO FEDERAL,ALESSANDRA DOS SANTOS MARQUES,66
2999,DEPUTADO FEDERAL,LUISA MELCÍADES RODRIGUEZ MARANHÃO,117
3000,DEPUTADO FEDERAL,RENÊ DA SILVA FREITAS,8143
3001,DEPUTADO FEDERAL,ANA CAROLINA SPONZA BRAGA,24934
3003,DEPUTADO FEDERAL,JOÃO ALBERTO NEVES DOS SANTOS,2392
3010,DEPUTADO FEDERAL,KATHARYNE AMORIM CAIAFFA,3500
3012,DEPUTADO FEDERAL,CLAUDIO ALEXANDRE DA CRUZ WEISSHUHN,506
3013,DEPUTADO FEDERAL,IDA DELRIO FISHER,604
3015,DEPUTADO FEDERAL,HERMAN GUEDES RODRIGUES DA SILVA,681
3017,DEPUTADO FEDERAL,ABRAÃO RAMOS PEREIRA BRAZ,3887
3020,DEPUTADO FEDERAL,MARCOS EPHRAIN DE MARINS,426
3021,DEPUTADO FEDERAL,BERNARDO ABREU SAMPAIO,5586
3022,DEPUTADO FEDERAL,TIAGO FERNANDES COELHO,608
3023,DEPUTADO FEDERAL,LUIZ FERNANDO SILVA DA CUNHA,203
3030,DEPUTADO FEDERAL,DAYVIANE FERNANDES GARCIA,3128
3031,DEPUTADO FEDERAL,NIUSETE KOROBINSKI,357
3033,DEPUTADO FEDERAL,IVANO RODRIGUES DA SILVA,1215
3036,DEPUTADO FEDERAL,CLAUDIA KARINA WILBERG DE CASTRO COSTA,615
3039,DEPUTADO FEDERAL,CHARBEL NICOLAU CAPAZ,617
3040,DEPUTADO FEDERAL,MARCOS JULIANO PEREIRA,677
3055,DEPUTADO FEDERAL,LEONARDO DE CARVALHO VIDAL,1119
3078,DEPUTADO FEDERAL,FLAVIANA DE CARVALHO,971
3080,DEPUTADO FEDERAL,CÉLIA MARIA DE ARAÚJO SILVA,425
3300,DEPUTADO FEDERAL,MARCELO DO NASCIMENTO,2083
3301,DEPUTADO FEDERAL,LEONARDO FIAUX DE ANDRADE,10112
3302,DEPUTADO FEDERAL,MARCELO HORTA DE ALBUQUERQUE,471
3303,DEPUTADO FEDERAL,ALEXANDRE DE SOUZA MUNIZ,747
3305,DEPUTADO FEDERAL,NIVIA FERNANDA SILVA,2914
3306,DEPUTADO FEDERAL,VALTER DE MELLO,341
3307,DEPUTADO FEDERAL,ANDERSON LUIZ BRAVO,491
3308,DEPUTADO FEDERAL,NIVALDA FARIA DE AGUIAR,81
3309,DEPUTADO FEDERAL,RITIELE MARIOTTI BORGES,330
3310,DEPUTADO FEDERAL,JEFFERSON BELO DE CASTRO,919
3311,DEPUTADO FEDERAL,LUIZ EDUARDO SOUZA DOS SANTOS REGO,395
3313,DEPUTADO FEDERAL,SUZANE FERREIRA VASCONCELLOS,200
3314,DEPUTADO FEDERAL,MONICA RODRIGUES DA SILVA,64
3315,DEPUTADO FEDERAL,SANDRO DA CONCEIÇÃO DA ROCHA,555
3316,DEPUTADO FEDERAL,MARCOS DIAS BORGES,1052
3317,DEPUTADO FEDERAL,ALEXANDRE GUSMÃO COIMBRA,406
3318,DEPUTADO FEDERAL,MARTINHO LUTERO PEREIRA MONTEIRO,797
3320,DEPUTADO FEDERAL,JARBAS SEVERINO OLIVEIRA,1888
3321,DEPUTADO FEDERAL,EDILBERTO SOARES COSTA,442
3322,DEPUTADO FEDERAL,PIETRO DI IORIO COMES,1893
3326,DEPUTADO FEDERAL,DAVID MUNIZ DINIZ,1136
3328,DEPUTADO FEDERAL,RICARDO NASCIMENTO LAURENTINO,1011
3330,DEPUTADO FEDERAL,ANA MARIA DA SILVA GONÇALVES,1065
3331,DEPUTADO FEDERAL,ERIKA FABRICIA OLIVEIRA PEIXOTO,87
3333,DEPUTADO FEDERAL,BRUNO CHAGAS DE BRITO DA SILVA,16360
3334,DEPUTADO FEDERAL,MAURO MARCIO DE PAULA ROSA,946
3337,DEPUTADO FEDERAL,GERSON DA SILVA PAULO,1511
3338,DEPUTADO FEDERAL,EZEQUIEL OLIVEIRA SILVA,2256
3340,DEPUTADO FEDERAL,JUVENAL VITOR PINTO DE CARVALHO,1114
3342,DEPUTADO FEDERAL,TAMIRES PIMENTEL MOREIRA,515
3344,DEPUTADO FEDERAL,MABELLE FERNANDA DE JESUS PEREZ,556
3345,DEPUTADO FEDERAL,MARCO ANTONIO FURTADO,873
3353,DEPUTADO FEDERAL,CLAUDIA DA SILVA FERREIRA,74
3355,DEPUTADO FEDERAL,BARBARA CRISTINA TEIXEIRA DE OLIVEIRA,305
3356,DEPUTADO FEDERAL,SANDRA SAMPAIO COSTA,209
3357,DEPUTADO FEDERAL,MANOEL DE MATOS FILHO,138
3359,DEPUTADO FEDERAL,GILMAR FERREIRA MARTINS,312
3360,DEPUTADO FEDERAL,LUIS CARLOS DA SILVA VIEIRA,1021
3366,DEPUTADO FEDERAL,PERRY SOUZA AZEREDO,2346
3375,DEPUTADO FEDERAL,ELIZABETE LOURDES BARBOZA,49
3377,DEPUTADO FEDERAL,MARCOS DIAS PEREIRA,19748
3378,DEPUTADO FEDERAL,MARIO RAMOS FILHO,686
3379,DEPUTADO FEDERAL,HELOISA SILVA DOS SANTOS,192
3381,DEPUTADO FEDERAL,CARLA CRISTINA MOTTA PEIXOTO,517
3393,DEPUTADO FEDERAL,MESAC EFLAIN DA SILVA ESPINDOLA,12345
3396,DEPUTADO FEDERAL,EDSON VINICIUS CORREA NASCIMENTO,1231
3399,DEPUTADO FEDERAL,GEFERSON JORGE OLIVEIRA DOS SANTOS,1270
3500,DEPUTADO FEDERAL,ANDRE LUIZ SILVA GOMES,850
3501,DEPUTADO FEDERAL,HELENA ALVES BRANDÃO WITZEL,492
3502,DEPUTADO FEDERAL,SILVANA AZEVEDO DE ARAUJO,450
3503,DEPUTADO FEDERAL,WASHINGTON LUIZ BERNARDINO DE SOUZA,2056
3504,DEPUTADO FEDERAL,VILLER TAVARES BARBOSA,340
3505,DEPUTADO FEDERAL,PAULO JOSE DOS SANTOS DE OLIVEIRA,345
3506,DEPUTADO FEDERAL,EVANDRO NASCIMENTO DE ABREU,514
3507,DEPUTADO FEDERAL,ARLEY SANTOS PEREIRA,293
3508,DEPUTADO FEDERAL,JAILTON SOARES BEZERRA,177
3510,DEPUTADO FEDERAL,CARLOS ALBERTO QUEIROZ MAIA,1330
3511,DEPUTADO FEDERAL,RONALDO LEONARDO DA SILVA,147
3512,DEPUTADO FEDERAL,LUIS URSULINO SANTANA,485
3513,DEPUTADO FEDERAL,LUIZ ANTONIO RIBEIRO GONÇALVES,523
3515,DEPUTADO FEDERAL,CARLA RENATA LANDES ROSA MEDINA,142
3520,DEPUTADO FEDERAL,GENIVALDO NOGUEIRA DA SILVA,613
3521,DEPUTADO FEDERAL,SERGIO LOPES COIMBRA,470
3522,DEPUTADO FEDERAL,RENATA NOGUEIRA O DONNELL,1108
3524,DEPUTADO FEDERAL,ANGELO SOUZA DE ALMEIDA,169
3527,DEPUTADO FEDERAL,MOISES FERREIRA,98
3535,DEPUTADO FEDERAL,RENATA DE OLIVEIRA ESTEVES,1458
3536,DEPUTADO FEDERAL,TANIA DIAS MARTINS BARBOZA,81
3537,DEPUTADO FEDERAL,GUARINO VILHENA DA SILVA,408
3538,DEPUTADO FEDERAL,ADENAIR MARIA DE MOURA TAYAR,209
3545,DEPUTADO FEDERAL,RUDSON VELASQUES GOMES,607
3549,DEPUTADO FEDERAL,ANA PAULA DA SILVA CASTRO,221
3550,DEPUTADO FEDERAL,JOSIAS DA SILVA CARVALHO,395
3551,DEPUTADO FEDERAL,CARLOS EDUARDO NEVES DE JESUS,630
3552,DEPUTADO FEDERAL,DEBORA OLIVEIRA DE MELO RICIO,865
3553,DEPUTADO FEDERAL,ALZIRA SEBASTIANA MARQUES REGIS,416
3554,DEPUTADO FEDERAL,ISABEL DE OLIVEIRA ACIMO,139
3556,DEPUTADO FEDERAL,NORLI MENEGHINI CARLINI LIRA,436
3561,DEPUTADO FEDERAL,ALEXANDRE CARVALHAL DA SILVA,193
3562,DEPUTADO FEDERAL,JOHN ALEX GOMES DOS SANTOS,133
3565,DEPUTADO FEDERAL,LUIZ ELPIDIO MARTINS MANHAES,823
3566,DEPUTADO FEDERAL,SHIRLEI DA SILVA VIEIRA,93
3570,DEPUTADO FEDERAL,JORGE LEIBE DE SOUZA PEREIRA,667
3576,DEPUTADO FEDERAL,JOSE NUNES DA SILVA,215
3577,DEPUTADO FEDERAL,JOSE MARIA FIDELIS DA SILVA,255
3578,DEPUTADO FEDERAL,ANDERSON ALVES BARRETO,1497
3580,DEPUTADO FEDERAL,RODRIGO DOS SANTOS TEIXEIRA,213
3585,DEPUTADO FEDERAL,GABRIELA DE ARAUJO TAVARES,97
3588,DEPUTADO FEDERAL,WELLINGTON RODRIGUES SOARES,1146
3592,DEPUTADO FEDERAL,SAULO ANDRE CHAVES DE CARVALHO,241
3595,DEPUTADO FEDERAL,SIRLEI APARECIDA DE OLIVEIRA BUBNOFF,82
3599,DEPUTADO FEDERAL,FABIO PERALTA DE OLIVEIRA,138
3600,DEPUTADO FEDERAL,MARCIO DE PAULA SANTOS,6194
3601,DEPUTADO FEDERAL,SHIRLEI DE OLIVEIRA ENGEL,642
3602,DEPUTADO FEDERAL,GLAUCIO SANTOS DA SILVA,1202
3607,DEPUTADO FEDERAL,ROMULO GOMES DE MATTOS,2829
3608,DEPUTADO FEDERAL,FERNANDO GOMES DE FREITAS,51
3609,DEPUTADO FEDERAL,ANDRE ARIGONE TELLES BARROS,519
3610,DEPUTADO FEDERAL,PATRICK ALEXANDRE DE OLIVEIRA,2129
3611,DEPUTADO FEDERAL,MARLI ALVES DA SILVA,445
3612,DEPUTADO FEDERAL,HELIO SEVERINO DE AZEVEDO,8393
3616,DEPUTADO FEDERAL,CARLOS ALEXANDRE DE OLIVEIRA,516
3618,DEPUTADO FEDERAL,MARIA ELIANE SANTOS DE MORAIS,698
3619,DEPUTADO FEDERAL,JOKLEYNE ANTONIO FARIA DA SILVA,970
3620,DEPUTADO FEDERAL,HUGO JOSE TAVARES,189
3621,DEPUTADO FEDERAL,MARIA JESUS FERNANDES DA SILVA,372
3622,DEPUTADO FEDERAL,ELITUSALEM GOMES DE FREITAS,3611
3623,DEPUTADO FEDERAL,OZORIO FONTOURA FERREIRA BARBOSA,630
3625,DEPUTADO FEDERAL,GILSELENE SANTOS ARRUZZO,467
3627,DEPUTADO FEDERAL,ERIKA GAMA ALBUQUERQUE,175
3633,DEPUTADO FEDERAL,CRISTIANE FLAVIA FRANCO,390
3635,DEPUTADO FEDERAL,ROSEMARY PEDREIRA NUNES CABRAL,312
3636,DEPUTADO FEDERAL,WILSON MARTINS COUTINHO,6646
3637,DEPUTADO FEDERAL,LEREMICE DOS ANJOS MACIEL,76
3640,DEPUTADO FEDERAL,OSNIR ROCHA DE SOUZA,596
3644,DEPUTADO FEDERAL,RAFAELLA TORRES LEANDRO DA ROCHA,440
3645,DEPUTADO FEDERAL,CARLOS ANDRE JESUS SANTOS,635
3648,DEPUTADO FEDERAL,VERONICA PENCO FIGUEIREDO,465
3650,DEPUTADO FEDERAL,WILLIANS TEIXEIRA MADALENA,569
3652,DEPUTADO FEDERAL,SIDNEY CANDIDO DA SILVA CAVALCANTE,428
3653,DEPUTADO FEDERAL,MAURICIO BARBOSA REIS,123
3655,DEPUTADO FEDERAL,EMERSON CRUZ DE OLIVEIRA,306
3660,DEPUTADO FEDERAL,RONILDO NAVEGA HENRIQUES,1037
3663,DEPUTADO FEDERAL,ADRIANO LEITE DE ANDRADE,558
3666,DEPUTADO FEDERAL,ROSILENE ETIENE MENDONÇA,240
3667,DEPUTADO FEDERAL,ZICRI LAMEQUE DA SILVA,2129
3669,DEPUTADO FEDERAL,FATIMA DENISE CAMPELO DE LIMA SOUZA,158
3670,DEPUTADO FEDERAL,ADILSON DOS REIS VIEIRA,178
3678,DEPUTADO FEDERAL,VANDA MARQUES DA COSTA,147
3680,DEPUTADO FEDERAL,WALBER CARVALHO DE ALMEIDA,1596
3681,DEPUTADO FEDERAL,FELIPE HENRIQUES TEIXEIRA RAMOS,257
3688,DEPUTADO FEDERAL,SERGIO ANTONIO PINTO DOS SANTOS,3064
3689,DEPUTADO FEDERAL,JOAO BOSCO DE SOUZA GESTAL,481
3690,DEPUTADO FEDERAL,THIAGO DE SOUZA LYRA,319
3693,DEPUTADO FEDERAL,ALEX SANDRO DA CONCEIÇÃO,464
3696,DEPUTADO FEDERAL,CLAUDIO HENRIQUE BARACK OBAMA DOS ANJOS,409
3698,DEPUTADO FEDERAL,CAMILLA DA CUNHA SANTIAGO,124
3699,DEPUTADO FEDERAL,JEAN CARLO DE MENEZES VILHENA,315
4000,DEPUTADO FEDERAL,EDUARDO CARVALHO BANDEIRA DE MELLO,72725
4001,DEPUTADO FEDERAL,MARCOS LOPES RIBEIRO,3327
4003,DEPUTADO FEDERAL,ALEXANDRE LUIS GONZAGA MADEIRA,469
4004,DEPUTADO FEDERAL,MARIA LUCÉLIA DOS SANTOS,10867
4005,DEPUTADO FEDERAL,ELISABETTA ZOTTOLO,231
4006,DEPUTADO FEDERAL,BEATRIZ MACIEL PONTES,1802
4007,DEPUTADO FEDERAL,ALEXANDRE SILVA SARAIVA,16204
4008,DEPUTADO FEDERAL,LEVI ALVES RODRIGUES DOS SANTOS,156
4009,DEPUTADO FEDERAL,FLAVIO LUCIANO RANCANO DE AZEVEDO ROSA,1075
4010,DEPUTADO FEDERAL,JOSÉ ARIMATHÉA OLIVEIRA,3570
4012,DEPUTADO FEDERAL,RAFAEL DE CASTRO ALVES ATALLA MEDINA,1044
4013,DEPUTADO FEDERAL,TATIANA MARINS ROQUE,30764
4015,DEPUTADO FEDERAL,MARCOS ANTONIO DE QUEIROZ LUCENA,526
4020,DEPUTADO FEDERAL,RAMON DE PAULA NEVES,487
4021,DEPUTADO FEDERAL,TIAGO GOMES DOS SANTOS,1731
4022,DEPUTADO FEDERAL,GABRIEL BICHARRA SANTINI PINTO,651
4027,DEPUTADO FEDERAL,SANDRA MARIA BORGES DE FREITAS,239
4030,DEPUTADO FEDERAL,NELSON DE CARVALHO JUNIOR,1286
4033,DEPUTADO FEDERAL,LEONARDO FRANCISCO DOS ANJOS,594
4040,DEPUTADO FEDERAL,WALDECK CARNEIRO DA SILVA,27879
4041,DEPUTADO FEDERAL,LUIZ CARLOS DA ROCHA NOVAES,2573
4044,DEPUTADO FEDERAL,JESSICA CRISTINA MIRANDA SANTOS,11427
4045,DEPUTADO FEDERAL,JORGE PAULO DA SILVA MENDES,641
4046,DEPUTADO FEDERAL,ARLINDO DE SOUZA TEIXEIRA,185
4048,DEPUTADO FEDERAL,ADRIELY ALVES OSÓRIO DA SILVA,1177
4050,DEPUTADO FEDERAL,MARCOS UCHÔA CAVALCANTI,850
4054,DEPUTADO FEDERAL,LOURDES DA SILVA PETRONILHO,380
4055,DEPUTADO FEDERAL,HUMBERTO ADAMI SANTOS JUNIOR,441
4056,DEPUTADO FEDERAL,ROSA MARIA CAMPOS PEREIRA,154
4060,DEPUTADO FEDERAL,JORDELI RODRIGUES DUTRA CHAVES,152
4065,DEPUTADO FEDERAL,KÊNIA AGUIAR FONTOURA DA SILVA,394
4067,DEPUTADO FEDERAL,MIRIANE SILVA COBALEA,207
4070,DEPUTADO FEDERAL,RAONE CASSIN MAIA FERREIRA,6312
4077,DEPUTADO FEDERAL,EDSON SANTOS DE SOUZA,2740
4078,DEPUTADO FEDERAL,ANDERSON DE SOUSA BESERRA LOPES,339
4080,DEPUTADO FEDERAL,ANTÔNIO EUDES RODRIGUES,348
4090,DEPUTADO FEDERAL,HENRIQUE ABRAHÃO CHARLES,2981
4097,DEPUTADO FEDERAL,ALVARO ANIBAL ALVES DE MAGALHÃES,12
4300,DEPUTADO FEDERAL,ADELZON ALVES,985
4310,DEPUTADO FEDERAL,SHEILA REGINA ARÃO DE OLIVEIRA SILVA,531
4321,DEPUTADO FEDERAL,ANDRÉ LUIZ LAZARONI DE MORAES,24389
4333,DEPUTADO FEDERAL,CARLA PIRANDA REBELLO,513
4358,DEPUTADO FEDERAL,HAMILTON ROCHA DE OLIVEIRA,199
4389,DEPUTADO FEDERAL,UDERSON MENEGUITE RIBEIRO,1144
4400,DEPUTADO FEDERAL,ROGÉRIO TEIXEIRA JUNIOR,70660
4401,DEPUTADO FEDERAL,JOÃO FRANCISCO INÁCIO BRAZÃO,77367
4404,DEPUTADO FEDERAL,SANDRO DA SILVA CRUZ,1016
4405,DEPUTADO FEDERAL,JIMMY DE OLIVEIRA CORRÊA,2662
4410,DEPUTADO FEDERAL,LUIZ ANTONIO FURLANI FILHO,22646
4411,DEPUTADO FEDERAL,PAULA MARY REIS DE ALBUQUERQUE,8135
4412,DEPUTADO FEDERAL,DANIELA MOTÉ DE SOUZA CARNEIRO,213706
4413,DEPUTADO FEDERAL,FLÁVIA PINHEIRO FRÓES,1361
4414,DEPUTADO FEDERAL,ALBERTO ELY BRIZOLA DA SILVA,1055
4415,DEPUTADO FEDERAL,VINICIUS MEDEIROS FARAH,38852
4418,DEPUTADO FEDERAL,NORMA MARGARIDA DE SOUSA CARVALHO,96
4419,DEPUTADO FEDERAL,JORGE MOREIRA THEODORO,16972
4420,DEPUTADO FEDERAL,JORGE LUIS SILVA DE MEDEIROS,2049
4421,DEPUTADO FEDERAL,GUSTAVO SANTOS DE SIMAS,3627
4422,DEPUTADO FEDERAL,RAQUEL NIEDERMEYER DENARDIN,9263
4423,DEPUTADO FEDERAL,SHIRLEY CARVALHAES DE CAMARGO,4396
4425,DEPUTADO FEDERAL,PEDRO ROGÉRIO VIEIRA CABRAL,14723
4427,DEPUTADO FEDERAL,ELAINE ALVES DE CARVALHO,578
4430,DEPUTADO FEDERAL,JOSÉ GERALDO VICTORIO GONÇALVES,7845
4433,DEPUTADO FEDERAL,PAULA FRANCINETE MACHADO DE JESUS,10235
4434,DEPUTADO FEDERAL,FABIO DA ROCHA BASTOS CAJUEIRO,2961
4440,DEPUTADO FEDERAL,ITAGIBE DO COUTO CABRAL,2131
4441,DEPUTADO FEDERAL,CLÁUDIO VASQUE CHUMBINHO DOS SANTOS,8448
4443,DEPUTADO FEDERAL,MARIA CRISTINA MEL DE ALMEIDA COSTA,23936
4444,DEPUTADO FEDERAL,MARCOS BEZERRA RIBEIRO SOARES,43533
4445,DEPUTADO FEDERAL,CAROLINA TRINDADE CORRÊA,2331
4447,DEPUTADO FEDERAL,MARCO ANTONIO SANTOS DE MELO,3162
4450,DEPUTADO FEDERAL,PAULO CESAR BALTAZAR DA NÓBREGA,14889
4452,DEPUTADO FEDERAL,MURILLO GOUVÊA RODRIGUES,49921
4454,DEPUTADO FEDERAL,ROBSON DOS SANTOS FRANÇA,5061
4455,DEPUTADO FEDERAL,MAURICIO LOPES DOS SANTOS,9403
4456,DEPUTADO FEDERAL,OTAVIO SANTOS SILVA LEITE,31085
4458,DEPUTADO FEDERAL,NEILTON VIRGILIO DE SOUZA JUNIOR,22285
4460,DEPUTADO FEDERAL,NILTON ALVES DE FARIA,4919
4465,DEPUTADO FEDERAL,ELDERSON FERREIRA DA SILVA,2147
4467,DEPUTADO FEDERAL,CARLA DA SILVA DA CRUZ CASSIANO,976
4470,DEPUTADO FEDERAL,ALTAMIR SENNA OLIVEIRA JUNIOR,7875
4474,DEPUTADO FEDERAL,VIVIANE CARVALHO PETISCO PINHEIRO,1707
4475,DEPUTADO FEDERAL,CELIA CRISTINA DA SILVA,1981
4477,DEPUTADO FEDERAL,DANIELLE DYTZ DA CUNHA,75810
4478,DEPUTADO FEDERAL,GISELE SANTOS DO NASCIMENTO TEIXEIRA,19370
4480,DEPUTADO FEDERAL,FRANCISCO FLORIANO DE SOUSA SILVA,6651
4488,DEPUTADO FEDERAL,FELIPE LEONE BORNIER DE OLIVEIRA,3669
4490,DEPUTADO FEDERAL,FABIANO OLIVEIRA PEREIRA,4508
4493,DEPUTADO FEDERAL,ANTONIO DA LUZ FURTADO,34652
4498,DEPUTADO FEDERAL,RICARDO MARTINS DAVID,43219
4499,DEPUTADO FEDERAL,CLEBIO LOPES PEREIRA,36453
4500,DEPUTADO FEDERAL,MARIA EDUARDA MELLO RODRIGUES DE CARVALHO,316
4501,DEPUTADO FEDERAL,ADRIANO RODRIGUES DE SOUZA,1322
4502,DEPUTADO FEDERAL,EVANDRO DIVINO MACHADO,1247
4503,DEPUTADO FEDERAL,RONALDO FERREIRA SEQUEIRA,41
4505,DEPUTADO FEDERAL,CLÁUDIA MARTA XAVIER DOS SANTOS,308
4507,DEPUTADO FEDERAL,MILTON QUEIROZ DA PAIXAO,2650
4514,DEPUTADO FEDERAL,NILCIMAR DE FREITAS VIEIRA,1324
4517,DEPUTADO FEDERAL,JOSÉ ALBERTO DA SILVA MOURA,7217
4518,DEPUTADO FEDERAL,MÔNICA BRASIL HENRIQUES AGUIAR,21
4522,DEPUTADO FEDERAL,JORGE HENRIQUES PIRES PAES,24089
4525,DEPUTADO FEDERAL,FROILAN MOREIRA DE MORAES,102
4526,DEPUTADO FEDERAL,LAURINDA JULIA GOMES,89
4527,DEPUTADO FEDERAL,MARCELO MOSQUEIRA TAVEIROS,450
4544,DEPUTADO FEDERAL,DRAULO VALENTE GOMES,2876
4545,DEPUTADO FEDERAL,JORGE ALBERTO FELIPE CURY,5506
4546,DEPUTADO FEDERAL,JOSÉ ÔNIX GOMES DA SILVA,455
4553,DEPUTADO FEDERAL,ELIANE PEREIRA DE SOUZA,294
4554,DEPUTADO FEDERAL,DANIELA DALILA IBARRA MAIA DE ANDRADE MACIEL,21913
4555,DEPUTADO FEDERAL,CRISTIANE DOS SANTOS BATISTA FERNANDES,2025
4567,DEPUTADO FEDERAL,ÍSIS CRISTINA RIBEIRO SILVA,402
4569,DEPUTADO FEDERAL,GESIEL DE OLIVEIRA LESSA,2019
4571,DEPUTADO FEDERAL,ALAN MANHAES DO NASCIMENTO,135
4577,DEPUTADO FEDERAL,FELICIANO JOSE DOS SANTOS RODRIGUES,148
4593,DEPUTADO FEDERAL,LIGYDO FERREIRA VAZ NETO,60
4598,DEPUTADO FEDERAL,JOSÉ SILVA DE SOUZA,407
5000,DEPUTADO FEDERAL,TARCÍSIO MOTTA DE CARVALHO,159928
5002,DEPUTADO FEDERAL,LUCIANA ARAÚJO DA SILVA PEREIRA,201
5004,DEPUTADO FEDERAL,ROBERTA CAROLINA DE BARCELOS,362
5005,DEPUTADO FEDERAL,NATALIA SOARES RIBEIRO,13530
5007,DEPUTADO FEDERAL,DAVID GOMES LOBO DOS SANTOS,5759
5010,DEPUTADO FEDERAL,THAIS DE SOUZA FERREIRA,17523
5012,DEPUTADO FEDERAL,MÁXIMO HELENO RODRIGUES LUSTOSA DA COSTA,1555
5013,DEPUTADO FEDERAL,JULIANA DA SILVA DRUMOND,4181
5020,DEPUTADO FEDERAL,MIRIANA BARBOSA AMARAL,213
5021,DEPUTADO FEDERAL,ADILSON THEODORO DA CUNHA,291
5022,DEPUTADO FEDERAL,WILLIAM CARLOS BRUM BISPO,15294
5023,DEPUTADO FEDERAL,ANDREA DE ARAÚJO CASSA,1756
5025,DEPUTADO FEDERAL,GILBERTO DE SOUZA VANDERLEI,554
5027,DEPUTADO FEDERAL,REGINA LUCIA DA SILVA FONTE,546
5029,DEPUTADO FEDERAL,FABIANO DE SOUZA VIEIRA,933
5030,DEPUTADO FEDERAL,JOEL LUIZ DOS SANTOS,305
5033,DEPUTADO FEDERAL,HENRIQUE DOS SANTOS VIEIRA LIMA,53933
5042,DEPUTADO FEDERAL,ANDRÉ MAGALHÃES BARROS,9785
5050,DEPUTADO FEDERAL,FRANCISCO RODRIGUES DE ALENCAR FILHO,115023
5051,DEPUTADO FEDERAL,JOÃO BATISTA OLIVEIRA DE ARAÚJO,827
5055,DEPUTADO FEDERAL,DENILSON PRATA DA SILVA,1423
5057,DEPUTADO FEDERAL,IVANETE CONCEIÇÃO DA SILVA,3046
5060,DEPUTADO FEDERAL,ELIEL BEZERRA DE LIMA JUNIOR,497
5071,DEPUTADO FEDERAL,ALEX CAMPANHAO DA SILVA,310
5077,DEPUTADO FEDERAL,TALÍRIA PETRONE SOARES,198548
5080,DEPUTADO FEDERAL,GLAUBER DE MEDEIROS BRAGA,78048
5088,DEPUTADO FEDERAL,MARCO ANTONIO MONTEIRO COUTINHO,1123
5089,DEPUTADO FEDERAL,FÁBIO BARAÚNA DOS SANTOS,237
5100,DEPUTADO FEDERAL,RAQUEL GOMES DA SILVA DOS SANTOS,1265
5101,DEPUTADO FEDERAL,ANA CLAUDIA PORTO PAES,691
5102,DEPUTADO FEDERAL,DEBORAH FARAH,557
5103,DEPUTADO FEDERAL,ALEXANDRE DE OLIVEIRA BRAGA,276
5105,DEPUTADO FEDERAL,ERIVELTO COSTA FIGUEIREDO,2635
5106,DEPUTADO FEDERAL,ROLAN DE MELO NASCIMENTO,557
5107,DEPUTADO FEDERAL,JORGE LEANDRO MIEIRO SARQUIS DA HORA,721
5108,DEPUTADO FEDERAL,MARIZETE KUHN,47
5110,DEPUTADO FEDERAL,RICARDO BARBIERI,1265
5111,DEPUTADO FEDERAL,VANESSA BASONI PACHECO,1853
5112,DEPUTADO FEDERAL,JEAN FABIO PASSOS DOS ANJOS,1420
5116,DEPUTADO FEDERAL,JOZIEL FERREIRA CARLOS,10040
5118,DEPUTADO FEDERAL,RONALDO CARTAXO TEIXEIRA,495
5120,DEPUTADO FEDERAL,PAULO CEZAR VIEIRA DE ALMEIDA FILHO,4490
5121,DEPUTADO FEDERAL,ERCILIA MARIA SILVEIRA,164
5122,DEPUTADO FEDERAL,JOSÉ BONIFÁCIO BEZERRA JUNIOR,4414
5123,DEPUTADO FEDERAL,HUGO PEREIRA DO CANTO JUNIOR,16670
5125,DEPUTADO FEDERAL,PATRICIA LADEIRA MOREIRA,246
5127,DEPUTADO FEDERAL,MARCELO HENRIQUE FERNANDES DE OLIVEIRA,135
5128,DEPUTADO FEDERAL,WELDERSON SIDNEY DA SILVA TEIXEIRA,5540
5131,DEPUTADO FEDERAL,LUCIA HELENA OLIVEIRA,463
5132,DEPUTADO FEDERAL,CATIA REGINA BATISTA DO NASCIMENTO,369
5133,DEPUTADO FEDERAL,CHRISTIANE BATISTA NERI,7328
5136,DEPUTADO FEDERAL,FLÁVIO JULIO NUNES PAIM,1079
5140,DEPUTADO FEDERAL,CARLOS ALBERTO LOPES DE MAGALHÃES,2582
5144,DEPUTADO FEDERAL,CARLOS ANTONIO RIBEIRO PEREIRA,372
5148,DEPUTADO FEDERAL,ANTONIO JOSÉ DE LIMA MESQUITA,216
5150,DEPUTADO FEDERAL,ALEXANDRE RODRIGUES METELLO,792
5151,DEPUTADO FEDERAL,CRISTOVÃO DOS SANTOS MOREIRA,4226
5152,DEPUTADO FEDERAL,MAX COSME BRANDÃO DE SOUZA,901
5155,DEPUTADO FEDERAL,MARIA GORETTI PINHEIRO MAIA GRIN PAULA,791
5156,DEPUTADO FEDERAL,CARLOS ALBERTO DE MACEDO,1108
5159,DEPUTADO FEDERAL,PAULO ANDERSON LIMA E SILVA,2041
5160,DEPUTADO FEDERAL,MARIO LUCIO DE SOUZA AGUIAR,615
5161,DEPUTADO FEDERAL,PAULO ANTONIO DA SILVA,936
5165,DEPUTADO FEDERAL,CLAUDIA SIMONE DOS SANTOS,257
5167,DEPUTADO FEDERAL,ROBSON LUIZ SANTANA VIEIRA,314
5169,DEPUTADO FEDERAL,ELISÂNGELA DA COSTA SILVA,4997
5170,DEPUTADO FEDERAL,JOSÉ GUILHERME DE MORAES NETO,790
5175,DEPUTADO FEDERAL,LÍDIA SACRAMENTO COSTA,482
5177,DEPUTADO FEDERAL,MARCELO DOS SANTOS LEMOS,279
5178,DEPUTADO FEDERAL,JAIR DA SILVA ROCHA,4360
5180,DEPUTADO FEDERAL,ALMIR OLIVEIRA MOURA,192
5183,DEPUTADO FEDERAL,GILMAR CARNEIRO DOS SANTOS,2344
5189,DEPUTADO FEDERAL,CLÓVIS JOSÉ DOS PASSOS FILHO,2097
5198,DEPUTADO FEDERAL,EVERALDO ANSELMO DE ARAUJO,187
5199,DEPUTADO FEDERAL,ALZEMIRA DE LIMA MARINS,284
5500,DEPUTADO FEDERAL,WILSON SILVA BESERRA,5780
5501,DEPUTADO FEDERAL,MARCELO CALERO FARIA GARCIA,47394
5502,DEPUTADO FEDERAL,MARIA ISABEL DA SILVA ROSA COSTA,787
5503,DEPUTADO FEDERAL,SONIA DE ARSOLINO,818
5505,DEPUTADO FEDERAL,EBER SILVA,9701
5507,DEPUTADO FEDERAL,ÁTILA ALEXANDRE NUNES PEREIRA,19853
5508,DEPUTADO FEDERAL,FERNANDA DE MELLO GUIMARÃES LEAL DE OLIVEIRA,2264
5510,DEPUTADO FEDERAL,HUGO LEAL MELO DA SILVA,50067
5511,DEPUTADO FEDERAL,JONES BARBOSA DE MOURA,32073
5512,DEPUTADO FEDERAL,FELIPE DOS SANTOS PEIXOTO,12852
5513,DEPUTADO FEDERAL,GILSON MARQUES FERREIRA SILVEIRA,2491
5515,DEPUTADO FEDERAL,ROBERTO DA SILVA SALES,2959
5516,DEPUTADO FEDERAL,CRISTIANE PEREIRA DE SOUZA,570
5517,DEPUTADO FEDERAL,ROBSON OLIVEIRA CONSTANTINO,14623
5520,DEPUTADO FEDERAL,RENATA MAGALHÃES TURQUES ARAÚJO,3022
5521,DEPUTADO FEDERAL,RENAN FERREIRINHA CARNEIRO,40540
5522,DEPUTADO FEDERAL,JOSÉ AUGUSTO NALIN,18109
5523,DEPUTADO FEDERAL,MARIANGÉLICA DA COSTA HERDY,541
5525,DEPUTADO FEDERAL,ANDRÉ LUIZ LEITE DOS SANTOS,2971
5527,DEPUTADO FEDERAL,FABIO DE OLIVEIRA COSTA,602
5530,DEPUTADO FEDERAL,CLAUDIA DE MELO LOVAIN,735
5533,DEPUTADO FEDERAL,ZAQUEU DA SILVA TEIXEIRA,8012
5537,DEPUTADO FEDERAL,KAREN VALLADARES DE FARIAS,1030
5541,DEPUTADO FEDERAL,JORGE HENRIQUE DA COSTA NUNES,1873
5544,DEPUTADO FEDERAL,ACHILLES ALMEIDA BARRETO NETO,22619
5545,DEPUTADO FEDERAL,ANDREIA ALMEIDA ZITO DOS SANTOS,8831
5550,DEPUTADO FEDERAL,SERGIO ALBERTO SOARES,3891
5551,DEPUTADO FEDERAL,ANA KARLA GUIMARÃES LUCAS,9950
5553,DEPUTADO FEDERAL,FRANCISCO SIEMSEN BULHÕES CARVALHO DA FONSECA,8867
5554,DEPUTADO FEDERAL,JOÃO JACQUES SOARES BUSNELLO,774
5555,DEPUTADO FEDERAL,PEDRO PAULO CARVALHO TEIXEIRA,76828
5556,DEPUTADO FEDERAL,MARIA DE FATIMA PEREIRA DE OLIVEIRA,6785
5559,DEPUTADO FEDERAL,PEDRO ROGERIO DUTRA DO VALLE,8327
5564,DEPUTADO FEDERAL,RACHID ELMOR,1839
5565,DEPUTADO FEDERAL,HILDEBRANDO GONÇALVES RODRIGUES,3558
5566,DEPUTADO FEDERAL,MARIA LAURA MONTEZA DE SOUZA CARNEIRO,48073
5567,DEPUTADO FEDERAL,SADINOEL OLIVEIRA GOMES SOUZA,6988
5569,DEPUTADO FEDERAL,PAULO CÉSAR DA GUIA ALMEIDA,2167
5570,DEPUTADO FEDERAL,TAYNÁ SENA SANTOS LIMA,2777
5575,DEPUTADO FEDERAL,LUCIANE DOS SANTOS RUFINO,990
5577,DEPUTADO FEDERAL,JOSÉ ROBERTO GAMA DE OLIVEIRA,25018
5580,DEPUTADO FEDERAL,ALEXANDRE EDUARDO DE OLIVEIRA,5879
5588,DEPUTADO FEDERAL,DANIEL RICARDO SORANZ PINTO,98784
5589,DEPUTADO FEDERAL,CAIO SANTOS VIANNA,36785
5593,DEPUTADO FEDERAL,LAURO CÉSAR BOTTO MAIA,2985
5597,DEPUTADO FEDERAL,VIVIAN ALENCAR DOS SANTOS FERREIRA,806
5599,DEPUTADO FEDERAL,WANDERLEY ALVES DE OLIVEIRA,24793
6500,DEPUTADO FEDERAL,FRANCISCO DE ASSIS FREITAS,913
6556,DEPUTADO FEDERAL,REJANE DE ALMEIDA,38322
6565,DEPUTADO FEDERAL,JANDIRA FEGHALI,84054
7000,DEPUTADO FEDERAL,SULAMITA DO CARMO DA SILVA,20401
7001,DEPUTADO FEDERAL,RODRIGO SOBROSA MEZZOMO,1096
7004,DEPUTADO FEDERAL,MARIA DA GLORIA DE SOUZA DE SOUZA,216
7006,DEPUTADO FEDERAL,LUCAS RODRIGUES MYRA TEIXEIRA,830
7007,DEPUTADO FEDERAL,SERGIO RICARDO DE OLIVEIRA CAPINAN,1236
7009,DEPUTADO FEDERAL,ANA PAULA COUTINHO JORGE,425
7010,DEPUTADO FEDERAL,GUSTAVO SILVA FERREIRA,717
7011,DEPUTADO FEDERAL,DERCILEI FRANÇA LEONARDO,1335
7012,DEPUTADO FEDERAL,MARCOS ABRAHÃO FILHO,12214
7013,DEPUTADO FEDERAL,IGOR CRESPO MARCOS,3728
7014,DEPUTADO FEDERAL,RICARDO ACIOLI SANTANA DOS SANTOS,232
7015,DEPUTADO FEDERAL,RONNY ERMIRIO SODRE GOUVEIA,783
7016,DEPUTADO FEDERAL,CLEMELSON JORGE DA SILVA,1744
7017,DEPUTADO FEDERAL,ALAN DOS SANTOS MARTINS,1191
7020,DEPUTADO FEDERAL,WILIANS BITTENCOURT VALENTE,381
7021,DEPUTADO FEDERAL,JORDANE CABRAL DA SILVA,1077
