NR_VOTAVEL,DS_CARGO,NM_VOTAVEL,QT_VOTOS
7022,DEPUTADO FEDERAL,GION CARLOS FLOR SILVA,2314
7023,DEPUTADO FEDERAL,MARTA SCAVUZZI DE ALENCAR IELMINI,112
7025,DEPUTADO FEDERAL,GERUSA SANTOS DA SILVA,1043
7027,DEPUTADO FEDERAL,WERNER BENITES SARAIVA DA FONSECA,1254
7028,DEPUTADO FEDERAL,MARCIO LOPES DIAS,417
7030,DEPUTADO FEDERAL,JOSÉ BERNARDO DE OLIVIERA,312
7033,DEPUTADO FEDERAL,MAICY MONTEIRO DO AMARAL,1331
7034,DEPUTADO FEDERAL,MICHELE MEDEIROS DE MOURA MELANDRE,396
7037,DEPUTADO FEDERAL,MARIZA BARBOSA ROGRIGUES,612
7040,DEPUTADO FEDERAL,JOÃO DINIZ DE ALMEIDA PORTO,15986
7044,DEPUTADO FEDERAL,ELIZANGELA SILVA DO NASCIMENTO,806
7045,DEPUTADO FEDERAL,NEREIDE FERREIRA PEDREGAL,8593
7050,DEPUTADO FEDERAL,VERA RAMOS DA SILVA,805
7051,DEPUTADO FEDERAL,ANDRÉA LUCIA LÖFGREN,252
7055,DEPUTADO FEDERAL,VINICIUS DE FREITAS DOS SANTOS,1609
7060,DEPUTADO FEDERAL,CRISTIANA CARVALHO MOTA,237
7064,DEPUTADO FEDERAL,IRACEMA BRAZ TULSEN,155
7066,DEPUTADO FEDERAL,CAIO FELIPE DA SILVA REIS MACHADO,741
7070,DEPUTADO FEDERAL,RODRIGO MOREIRA LAEBER,6059
7071,DEPUTADO FEDERAL,JOSEF ALEXANDRE GERSTEL,268
7072,DEPUTADO FEDERAL,DENIS DE SOUSA MOURA,4340
7074,DEPUTADO FEDERAL,ROSENI DE AZEVEDO CAMILO,319
7076,DEPUTADO FEDERAL,EMERSON ALBERTO FERREIRA,492
7077,DEPUTADO FEDERAL,GLEISON DE SOUZA TRINDADE,2140
7080,DEPUTADO FEDERAL,JUSCELINO CRUZ DE ARAUJO,761
7081,DEPUTADO FEDERAL,GUILHERME MENEZES DA SILVA,747
7085,DEPUTADO FEDERAL,WAGNER GAMA BAPTISTA,542
7088,DEPUTADO FEDERAL,THIAGO VASCONCELOS LEITE PINHEIRO,4141
7090,DEPUTADO FEDERAL,ROSANE CORREA DOS SANTOS,621
7097,DEPUTADO FEDERAL,PAULO THIAGO FONSECA DE ARAUJO RIBEIRO,2437
7099,DEPUTADO FEDERAL,FLAVIO FERNANDO PRADO,28365
7700,DEPUTADO FEDERAL,SANDRO MATOS PEREIRA,11517
7702,DEPUTADO FEDERAL,MARCUS VINICIUS SANTOS DA SILVA,4736
7703,DEPUTADO FEDERAL,SUELEN CRISTINA DOS SANTOS,387
7704,DEPUTADO FEDERAL,MARILYN WERNER,807
7705,DEPUTADO FEDERAL,LUANA VIEIRA DA SILVA,197
7707,DEPUTADO FEDERAL,HELDER LUIZ IVO DOS SANTOS,1282
7710,DEPUTADO FEDERAL,ALEXANDRINA LOPES DE ALMEIDA FALCAO,1860
7712,DEPUTADO FEDERAL,THIAGO SANDERSON SANTOS DA CUNHA,968
7714,DEPUTADO FEDERAL,JOSÉ CARLOS PORTO NETO,5199
7715,DEPUTADO FEDERAL,CARLOS ALBERTO DE OLIVEIRA RODRIGUES,1676
7716,DEPUTADO FEDERAL,TIAGO NUNES DA CUNHA FILHO,208
7720,DEPUTADO FEDERAL,NATÁLIA LOPES QUINQUINO DE LIMA,1206
7721,DEPUTADO FEDERAL,HAROLDO PEÇANHA NEIVA,298
7722,DEPUTADO FEDERAL,THIMOTEO CAVALCANTI ALBUQUERQUE DE SÁ,7362
7723,DEPUTADO FEDERAL,MARCELO SAMUEL BARBOSA DA SILVA,3187
7725,DEPUTADO FEDERAL,ALEXANDRE MARQUES CORDEIRO,3483
7727,DEPUTADO FEDERAL,ALEXANDRE DOS SANTOS SALGADO,712
7729,DEPUTADO FEDERAL,GILBERTO SANTOS PEREIRA,120
7730,DEPUTADO FEDERAL,CARLOS EDUARDO DO NASCIMENTO SOARES,6845
7731,DEPUTADO FEDERAL,MYRIAN MARIA DE SOUZA ROCHA,125
7733,DEPUTADO FEDERAL,AUREO LIDIO MOREIRA RIBEIRO,103321
7737,DEPUTADO FEDERAL,EDIMARCIA GONÇALVES DA SILVA,143
7744,DEPUTADO FEDERAL,FERNANDA GUACIRA ARAÚJO CAMPISTA,1996
7745,DEPUTADO FEDERAL,MARCOS NATALINO SOUZA DE LIMA,1547
7747,DEPUTADO FEDERAL,LUCIANA DE OLIVEIRA GOMES,152
7749,DEPUTADO FEDERAL,CLÁUDIA AUGUSTA DOS SANTOS DE ALMEIDA,343
7750,DEPUTADO FEDERAL,WASHINGTON LUIZ PINTO MACHADO,878
7751,DEPUTADO FEDERAL,CRISTIANO JOSÉ RODRIGUES DE SOUZA,8500
7752,DEPUTADO FEDERAL,ERIVELTO CÂMARA DE LUNA,1614
7753,DEPUTADO FEDERAL,MARCELO LUIZ SANTIAGO,560
7755,DEPUTADO FEDERAL,LEANDRO DE AZEVEDO,16766
7757,DEPUTADO FEDERAL,MARCOS FERREIRA DOS SANTOS JARON,431
7762,DEPUTADO FEDERAL,ERIVELTON DE SOUZA PEREIRA,402
7766,DEPUTADO FEDERAL,RAFAEL QUERIDO SOARES,832
7767,DEPUTADO FEDERAL,KELY MARIA LOUZADA MACHADO SILVA,880
7770,DEPUTADO FEDERAL,WALMER JORGE MACHADO,1101
7772,DEPUTADO FEDERAL,ANATIELY MATTOS DE OLIVEIRA BARBOSA,1210
7777,DEPUTADO FEDERAL,MARCELO DE SOUZA LESSA,3865
7778,DEPUTADO FEDERAL,SERGIO LEITE DOS SANTOS,260
7780,DEPUTADO FEDERAL,ERICA CRISTINA SANTANA NUNES,1676
7781,DEPUTADO FEDERAL,GEORGE MANGE BEZERRA,3560
7787,DEPUTADO FEDERAL,ALEXANDRE RODRIGO XAVIER BERRETA,2478
7788,DEPUTADO FEDERAL,CRISTIANO GAMA DE ALMEIDA,5054
7789,DEPUTADO FEDERAL,CARLOS ANTONIO OLIVEIRA DE AQUINO,432
7790,DEPUTADO FEDERAL,EDUARDO FRANCELINO DA SILVA NETO,2438
7792,DEPUTADO FEDERAL,PRISCILA COSTA WAGNER,301
7799,DEPUTADO FEDERAL,ROSANGELA VIEIRA DA SILVA,1039
9000,DEPUTADO FEDERAL,SERGIO DA COSTA ARAUJO,2696
9001,DEPUTADO FEDERAL,SERGIO AMÂNCIO DE SOUZA PORTO,9131
9002,DEPUTADO FEDERAL,MALU MOREIRA ALCANTARA,1541
9004,DEPUTADO FEDERAL,CASSIO AVELAR,31
9005,DEPUTADO FEDERAL,IVANI BARRETO DE ALMEIDA CRAVO,77
9007,DEPUTADO FEDERAL,JOEL NATALINO SANTANA,2184
9009,DEPUTADO FEDERAL,NELSON DA COSTA DURÃO,661
9010,DEPUTADO FEDERAL,MARCUS VINICIUS DE ALMEIDA BRAGA,11452
9011,DEPUTADO FEDERAL,GEORGE WILLIAM LEANDRO BARBOSA,1072
9012,DEPUTADO FEDERAL,MARCIO JOSÉ MATOS PONCIO DE SOUZA,33367
9013,DEPUTADO FEDERAL,WALLACE DE ALMEIDA DOS SANTOS,4701
9015,DEPUTADO FEDERAL,PAULO AUGUSTO AFFONSO LEONE,420
9017,DEPUTADO FEDERAL,DAVID DE OLIVEIRA ANTUNES,252
9018,DEPUTADO FEDERAL,MONICA RIBEIRO FRANÇA DOS SANTOS,27
9020,DEPUTADO FEDERAL,JOSÉ EDSON VIEIRA DA SILVA,1344
9021,DEPUTADO FEDERAL,LENIR MORAIS FERREIRA,3627
9022,DEPUTADO FEDERAL,GLAUBER MEDEIROS POUBEL,35716
9025,DEPUTADO FEDERAL,JANA CARLA CARDOSO,542
9030,DEPUTADO FEDERAL,JORGE DE SOUZA,111
9033,DEPUTADO FEDERAL,ANDREA GUIMARÃES TAVARES ROCHA,183
9039,DEPUTADO FEDERAL,PAULO SERGIO DA SILVA NEVES,133
9044,DEPUTADO FEDERAL,LUIS CLAUDIO DE OLIVEIRA MAIA,855
9049,DEPUTADO FEDERAL,CLAUDIA DA SILVA,57
9050,DEPUTADO FEDERAL,MARIO SERGIO CARDOSO SILVA,967
9051,DEPUTADO FEDERAL,CARLOS ROBERTO DOS SANTOS,689
9055,DEPUTADO FEDERAL,PEDRO LUIS BARBOSA SALLES,1663
9056,DEPUTADO FEDERAL,JOAO ELIAS DOS SANTOS,1178
9060,DEPUTADO FEDERAL,MÁRCIA RODRIGUES WALLIER,489
9066,DEPUTADO FEDERAL,CAROLINA MARIA CARDOSO CALDEIRA DE LACERDA,305
9070,DEPUTADO FEDERAL,SHIRLENE PEREIRA MENDES DE JESUS,227
9075,DEPUTADO FEDERAL,CÉLIA MARIA DIAS PEREIRA,92
9080,DEPUTADO FEDERAL,ARI JORGE MESQUITA DE SOUZA,518
9081,DEPUTADO FEDERAL,GUSTAVO HENRIQUE SOUZA AGUIAR,2753
9088,DEPUTADO FEDERAL,VITORIA DA SILVA ALMEIDA,117
9089,DEPUTADO FEDERAL,SULLIVAN NETTO PACHECO,1744
9090,DEPUTADO FEDERAL,MAX RODRIGUES LEMOS,89507
9091,DEPUTADO FEDERAL,MARCELO MARQUES PESSOA,766
9092,DEPUTADO FEDERAL,JOSÉ ANTONIO MARQUES CAVALCANTI DE SÁ,4230
9093,DEPUTADO FEDERAL,THIAGO GOMES DO AMARAL,17
9095,DEPUTADO FEDERAL,ADEMIR DA COSTA PANCOTE,599
9097,DEPUTADO FEDERAL,ALAINE CONCEIÇÃO DE OLIVEIRA,312
9098,DEPUTADO FEDERAL,MAURICIO VIEIRA MAIA,167
9099,DEPUTADO FEDERAL,JORGE ESTEVES,28881
